text_id,sentence,label
1_PHZH_380c4394_904e75e1_9c114cfc_4fcd40fc_7a669003_introduction.txt,zweiter Teil Arbeit dienen Erfassung geeignet Fördermassnahmen Ausbildung Argumentationsfertigkeit leisten somit Beitrag kritisch [ e ] verantwortungsbewusst [ e ] [ D ] enken [ H ] andeln ” PHZH o. J. S.  Lernende,3g
1_PHZH_2014_MS1_f89ebf2e_introduction.txt,bedeuten Ziel Arbeit Verbesserung eigen Unterricht,3a
1_PHZH_2014_MS1_53b4b6ca_introduction.txt,. evidenzbasiert Erkenntnis Hatties umfangreich Analyse lernwirksam Lehrhandeln,3b
1_PHZH_59a90fd8_4fcd40fc_5327f408_ Departement Sekarstufe I_437a0090_introduction.txt,Kapitel aktuell Stand Forschung bezüglich neu Medium Unterricht vorstellen,3g
1_PHZH_c0c47aac_e01a3e09_a63acd73_4fcd40fc_7a669003_introduction.txt,Geschichte beziehen Geschichtsbilder Gefüge relativ stabil Vorstellung Individuum Gruppe ganz Gesellschaft Vergangenheit  Bergmann  S.,1d
1_PHZH_ac9f8553_4fcd40fc_d59f3d3c_904e75e1_7a669003_introduction.txt,Metzler sehen ebenfalls Zusammenhang Mobbing schulisch Leistungen. sozial Schicht Eltern beitragen Kind Opfer Mobbing,0
2_PHZH_ed537019_4fcd40fc_dc411c57_65ccb701_7a669003_introduction.txt,unabhängig davon Aufgabe Schule Schülerin Schüler bestmöglich Ausbau Sprachkompetenze unterstützen,0
1_PHZH_2014_MS1_2b75f2b3_introduction.txt,anschliessend Ergebnis Videoanalyse präsentieren illustrieren,3g
1_PHZH_59a90fd8_4fcd40fc_5327f408_ Departement Sekarstufe I_437a0090_introduction.txt,Erkenntnis Arbeit sollen Handlungsweise aufzeigen Schülerin Schüler Lernprozess Fertigkeitstrainer optimal begleiten fördern,3a
1_PHZH_838eb8a3_4fcd40fc_ Departement Sekarstufe I_a665daa3_9a79bf39_introduction.txt,Darstellung Ergebnis Kapitel ) Interpretation Kapitel  Ergebnis Theorie Zusammenhang bringen Schlussfolgerunge Kapitel  formulieren Ziel Antwort zentral Fragestellung vorliegend Arbeit erhalten,3g
1_PHZH_87e91429_c53a9081_4fcd40fc_fb1cabbf_ Departement Sekarstufe I_introduction.txt,theoretisch Teil folgen Kapitel Fragestellung anhand vorgestellt Theorie begründen,3g
1_PHZH_2011_MS1_f89749b3_introduction.txt,Begriff Selbstkompetenz je Fachliteratur Schule ganz verschieden Bereich Fähigkeit verstehen,1d
1_PHZH_2014_MS1_2b75f2b3_introduction.txt,reformpädagogisch Wandel bringen praktisch Herausforderung Bereich Unterrichten stössen weit Teil Bevölkerung Bedenken fühlen Lehrperson überfordern Heterogenität meistern befürcht Eltern privilegiert Kind negativ Einfluss Leistung Schützlinge,0
1_PHZH_607d1004_e01a3e09_a63acd73_7a669003_4fcd40fc_introduction.txt,drei weit Studie nämlich Entwicklung Richtung Rede,1e
1_PHZH_8a10f9ae_e23bf532_4fcd40fc_57c4b296_6c2cf7e3_7a669003_introduction.txt,. Bezug Standard pädagogisch Hochschule Zürich,0
1_PHZH_c53a9081_057a2bfb_4fcd40fc_87e91429_7a669003_introduction.txt,folgend Forschungsfrag dafür Arbeit formulieren verstehen jugendliche Leistungssituation,3b
1_PHZH_2014_MS1_0ccb5f81_introduction.txt,Kapitel Forschungsfrage formulieren Erkenntnis zwei vorausgegang Kapitel zusammensetzen Untersuchungsteil Arbeit richten,3g
1_PHZH_2014_MS1_2b75f2b3_introduction.txt,gleich Zug sollen Standard Planung Durchführung Unterricht nennen,0
1_PHZH_607d1004_e01a3e09_a63acd73_7a669003_4fcd40fc_introduction.txt,Unterschied lassen drei untersucht Film Bezug Darstellung beide Kriegspartei anhand gezeigt Geschichtsbilder feststellen,3b
1_PHZH_af46a886_3beda123_b58d1e70_09717d62_c70fa686_dfcfd993_4fcd40fc_3567c78e_c713876f_0034d060_introduction.txt,schriftlich Fragebogen erfragen Schülerin Schüler Interesse Genetik anhand standardisiert Item,3d
1_PHZH_0633597c_9777b73e_4fcd40fc_7a669003_fc19e214_introduction.txt,• Schülerin Schüler Mitschülerin Mitschüler mathematisch Aufgabenstellung erklären Verständnis darüber überprüfen,0
1_PHZH_7a669003_b5e98c9a_c7296853_21428f03_introduction.txt,jugendliche lernen Problem eigenständig erkennen eignen adäquat Problemlösestrategie,0
1_PHZH_2012_MS1_e868b043_introduction.txt,Lehrperson Gespräch Eltern Schulbehörden immer darauf anweisen bildungspolitisch argumentieren etwa darum gehen projektwoch Musik begründen Geldausgabe Wahlfach Schülerband belegen,0
1_PHZH_87e91429_c53a9081_4fcd40fc_fb1cabbf_ Departement Sekarstufe I_introduction.txt,• Unterschied Abteilung B erkennbar,3b
1_PHZH_87e91429_c53a9081_4fcd40fc_7a669003_e696c4b9_introduction.txt,folgen Auseinandersetzung aktuell Literatur wobei Bewältigungsprozeß Anforderung Detaillierter erläutern,3g
1_PHZH_2014_MS1_7db60009_introduction.txt,mehrere Forscher feststellen Bild positiv neutral negativ Einfluss lernen Levin et al.  Winn  Rieber  Pettersson,1e
1_PHZH_2014_MS1_6c80d44e_introduction.txt,theoretisch Rahmen beinhalten Behandlung bereits hergeleiteten Fragestellung entnommen Leitbegriffen,3g
1_PHZH_4fcd40fc_7a669003_74d8fd0c_22f17b9d_introduction.txt,Werkzeug sollen mittels Erprobung Schulklasse evaluieren,3d
1_PHZH_3f0e91e4_4a97c710_dd8574ec_124b0b6b_4fcd40fc_7a669003_introduction.txt,vierter letzter Teil Arbeit These Professionstheorien explizit Bezug Theorie Praxis vornehmen daher Bedingung Berufseinstieg finden lassen erneut aufgreifen,3g
1_PHZH_01491c28_4fcd40fc_6ab73ff2_c7296853_ Departement Sekarstufe I_introduction.txt,Unterkapitel widmen zudem Methode Experteninterview Untersuchung anwenden,3g
1_PHZH_2014_MS1_8a45a584_introduction.txt,Arbeit beginnen Aufarbeitung theoretisch Hintergrund,3g
1_PHZH_b63cee49_764f4fe1_1e8ec8a0_d4c16655_introduction.txt,Extensives Lesen scheinen positiv Auswirkung Sprachkompetenz unabhängig Zielgruppe Sprache äusseren Umstand beispielsweise Sprache Art Programm,0
1_PHZH_2014_MS1_cf8586bd_introduction.txt,Interview dienen je zwei Schülerinn Wort kommen lassen Erkenntnis theoretisch Arbeit anhand Stichprobe überprüfen betroffener Stimme geben,3d
1_PHZH_c0c47aac_e01a3e09_a63acd73_4fcd40fc_7a669003_introduction.txt,Geschichtsbilder Jugendroman er er Jahr Opfer vermuen leiden tragisch Schicksal Ohnmacht Vordergrund stehen,0
1_PHZH_2014_MS1_b11a5d4b_040b4719_introduction.txt,zudem beschäftigen Anfang Frage Autonomie überhaupt möglich Schulbesuch ja freiwillig Unterricht finden klar festgelegt Zeit statt,0
1_PHZH_416b9c70_4fcd40fc_34e280f1_7a669003_a43bb46c_introduction.txt,Methodenteil stellen Methode Vorgehensweise Auswertung,3g
1_PHZH_180dda13_7a669003_4d668c53_4fcd40fc_introduction.txt,Frage frei Schulwahl Ebene Volksschule schon seit Jahr öffentlich diskutieren,0
1_PHZH_2014_MS1_81e0174a_introduction.txt,kommen immer Glück Aha-Erlebniß,0
1_PHZH_607d1004_e01a3e09_a63acd73_7a669003_4fcd40fc_introduction.txt,versuchen mittels Untersuchung herausfinden inwieweit Aussage drei ausgewähln beide aktuelleren Spielfilm zutreffen inwiefern drei Bezug Thematik voneinander unterscheiden,3a
1_PHZH_2014_MS1_cf8586bd_introduction.txt,• Herausforderung SuS materiell arm Familie konfrontieren Einfluss positiv Entwicklungsverlauf,3b
1_PHZH_2014_MS1_2b75f2b3_introduction.txt,anschliessend Gruppenarbeit definieren typisch Gruppenphänomene darlegen,3g
1_PHZH_2014_MS1_cf8586bd_introduction.txt,Kapitel Methode Durchführung Auswertung Interview beschreiben,3g
1_PHZH_4fcd40fc_2ddc90ae_7a669003_c72b17ed_introduction.txt,Thema Coaching hoch Relevanz Oberstufe Egg allgemein Schulentwicklung gefasst Sinn,1c
1_PHZH_607d1004_e01a3e09_a63acd73_7a669003_4fcd40fc_introduction.txt,Vietnamkrieg US-amerikanisch Beteiligung darstellen diskutieren,0
1_PHZH_2014_MS1_f89ebf2e_introduction.txt,Kapitel . untergeordnet Kapitel .. .. beschäftigen Berücksichtigung Leseschwachen Schüler Schülerin binnendifferenziert Leseförderung sowie Bedingung Textverstehen Gold et al,3g
1_PHZH_2014_MS1_93f526f5_introduction.txt,Schweizer Bildungssystem sehen Ende Primarstuf Selektionierung infolgedessen Schülerin Schüler Grundlage Gesamtbeurteilung Abteilung A  evt C Sekundarstufer I zuteilen,0
1_PHZH_2014_MS1_1f00be7e_aa2ab8ba_introduction.txt,Werkzeug Datenerhebung darlegen Durchführung erläutern,0
1_PHZH_2014_MS1_55a2d87e_introduction.txt,Merkmal beruflich Segregation aufzeigen erklären gemeinhin Frauenund Männerberuf verstehen Kapitel .,3g
1_PHZH_01491c28_4fcd40fc_6ab73ff2_c7296853_ Departement Sekarstufe I_introduction.txt,Schulleiterinne Schulleiter derjenige Person allfällig Veränderung frei Schulwahl direkt umgehen Müsst,0
1_PHZH_59a90fd8_4fcd40fc_5327f408_ Departement Sekarstufe I_437a0090_introduction.txt,Kapitel neu Mathematiklehrmittel Konzept Lehrmittel zugrunde liegen beschreiben,3g
1_PHZH_87e91429_c53a9081_4fcd40fc_7a669003_e696c4b9_introduction.txt,Entwicklung jugendliche stehen Zentrum Arbeit,2a
1_PHZH_2014_MS1_2d4399d5_introduction.txt,Masterarbeit Versuch erkennen Verwend Textprozedur Bildbeschreibung fördern Verständlichkeit Text Autor Leser verbessern,3a
1_PHZH_4fcd40fc_e01a3e09_a43b8048_7a669003_8450ab59_introduction.txt,vorliegend Arbeit gliedern vier Hauptteil THEORIE FORSCHUNGSMETHODE FORSCHUNGSERGEBNISSEN SCHLUSSTEIL,3g
1_PHZH_4fcd40fc_2ddc90ae_7a669003_c72b17ed_introduction.txt,weit Ziel Bereich Professionalisierung Gespräch passieren,3a
1_PHZH_2014_MS1_956d232e_introduction.txt,untersuchen Erwartung Schülerin Schüler Gemeinde Kanton Zürich womit Endeffekt Gemeinde,3e
1_PHZH_2011_MS1_a1ee7fc8_introduction.txt,folgend Kapitel begründen Reflexion bisherig Berufswahlunterricht Sekundarstufe C Ausgangslage These Fragestellung vorliegend Aktionsforschungsprojekt,3g
1_PHZH_838eb8a3_4fcd40fc_ Departement Sekarstufe I_a665daa3_9a79bf39_introduction.txt,Arbeit Fokus kognitiv Kompetenz Heterogenität legen,2a
1_PHZH_2f466bfd_4fcd40fc_42ed659e_7a669003_2ca5a840_a729a264_introduction.txt,Eltern jugendliche Lehrperson müssen zusammenarbeiten gleich Strick ziehen,0
1_PHZH_2014_MS1_8d8dd7fa_introduction.txt,Kompetenz folgen beschreiben Schülerin Schüler Entwicklung Innovation Design Technik Vernetzung analysieren diskutieren z.B. Stickcomputer CNC-Maschine D-Drucker,0
1_PHZH_c0c47aac_e01a3e09_a63acd73_4fcd40fc_7a669003_introduction.txt,möchten Ergebnis Untersuchung Hinblick Tätigkeit Geschichtslehrperson reflektieren,3a
1_PHZH_2014_MS1_956d232e_introduction.txt,erläutern zuerst theoretisch Hintergrund Forschungsstand Fragestellung,3g
1_PHZH_4fcd40fc_09a8ec4a_ Departement Sekarstufe I_a6ac235e_d435f07a_introduction.txt,Einführung Frühenglisch Struktur Organisation Englischunterricht ändern erster Schritt Rahmenbedingung Zürcher Oberstufenschule Bezug Englischunterricht erläutern Unterrichtsqualität Hinblick Lesen Englischunterricht beschreiben,0
1_PHZH_607d1004_e01a3e09_a63acd73_7a669003_4fcd40fc_introduction.txt,Studie grundlegend Begriff untersucht Bereich definieren aktuell wissenschaftlich Diskurs aufzeigen,0
1_PHZH_2014_MS1_956d232e_introduction.txt,dürfen kleinmachen Selbstvertrauen Orientierung geben,0
1_PHZH_2014_MS1_55a2d87e_introduction.txt,danach Stand Forschung rund Gender UN typisch Berufswahl umrissen Kapitel,3g
1_PHZH_416b9c70_4fcd40fc_34e280f1_7a669003_a43bb46c_introduction.txt,gehen darum untersuchen Lehrperson dahinter stehen motivieren bedrücken schwierig,0
1_PHZH_2014_MS1_7dc244ae_introduction.txt,weit Teil verschieden Unterrichtsmethode -konzepte inklusive Klasse präsentieren diskutieren,3g
1_PHZH_9bb4c1ff_cb53f07d_9ea67f3f_7a669003_introduction.txt,vorliegend Arbeit möchten herausfinden gelingen Unterricht professionalisieren,3a
1_PHZH_575b52ea_4fcd40fc_a72390b6_ Departement Sekarstufe I_introduction.txt,Methodenteil Kapitel  methodisch vorgehen vorstellen,3g
1_PHZH_380c4394_904e75e1_9c114cfc_4fcd40fc_7a669003_introduction.txt,Studie stellen Kuhn fest  überwiegend Mehrheit erwachsene schaffen stichhaltig Begründunge Argument liefern Gegenargument entwickeln entkräften  Kuhn  zitieren Astleitner  S.,1e
1_PHZH_2014_MS1_8d8dd7fa_introduction.txt,Technikbegriff umfassen technisch Objekt berücksichtigen menschlich Handlung Herstellung Gebrauch Entsorgung Objekt anfallen,1d
1_PHZH_2bb5e5c8_bc3c1032_e01a3e09_4fcd40fc_27c6f769_introduction.txt,Forschung Unterrichtseinheit zwei . Sek A Klasse durchführen,3e
1_PHZH_2014_MS1_81e0174a_introduction.txt,Fragebogen gliedern zwei Teil,3d
1_PHZH_2011_MS1_f89749b3_introduction.txt,unmöglich gleichzeitig verfolgen bearbeiten konzentrieren Arbeit Aspekt Selbstmanagement Selbstregulation Bereich Hausaufgabe,2a
1_PHZH_2011_MS1_f89749b3_introduction.txt,Beginn Ausgangslage verbunden Fragestellung erklären,3g
2_PHZH_e40e74be_a63acd73_9d47141a_7a669003_introduction.txt,suchen vorliegend Film Darstellung Ursache Ende Sklaverei,0
1_PHZH_2014_MS1_4baa6d00_introduction.txt,Arbeit gelten herausfinden moralisch Entwicklung Lernende fördern Entwicklung denken lernend Gegenstand Untersuchung,3a
1_PHZH_607d1004_e01a3e09_a63acd73_7a669003_4fcd40fc_introduction.txt,Konvention Kriegsfilm voraussetzen Thema nächster Zeile,0
1_PHZH_4fcd40fc_7a669003_74d8fd0c_22f17b9d_introduction.txt,Sonne Rücken erscheinen Planet Foto riesig blau Murmel,0
2_PHZH_fb178718_98736795_8af323c6_4fcd40fc_ Departement Sekarstufe I_02f55750_introduction.txt,Standard legen Kompetenz fest Schülerin Schüler Ende Unterrichtseinheit erreichen sollen,0
1_PHZH_ac9f8553_4fcd40fc_d59f3d3c_904e75e1_7a669003_introduction.txt,sollen LeserInnen ermöglichen subjektiv Sichtweise Objektiv verbinden,0
1_PHZH_2014_MS1_ab063590_introduction.txt,schriftlich kommunizieren Gesellschaft unerlässlich Kompetenz,1c
1_PHZH_8a10f9ae_e23bf532_4fcd40fc_57c4b296_6c2cf7e3_7a669003_introduction.txt,anschliessend folgen Erläuterung Begründung Vorgehen Konzeption erster Version schulisch Präventionsprojekt,3g
1_PHZH_8a10f9ae_e23bf532_4fcd40fc_57c4b296_6c2cf7e3_7a669003_introduction.txt,erster Linie gehen Forschungsfrage somit darum herausfinden Optimierung erster Version Präventionsprojekt vornehmen wirkungsvoll Präventionsarbeit leisten,3b
1_PHZH_380c4394_904e75e1_9c114cfc_4fcd40fc_7a669003_introduction.txt,erster Teil Arbeit gehen darum  Argumentation Forschungskontext einzubetten definieren ausgewählt Argumentationstheorie darstellen,3g
1_PHZH_2014_MS1_7db60009_introduction.txt,Kultur allerdings Auseinandersetzung Bild zugunsten Beschäftigung Text vernachlässigen  Ballstaedt  S.,0
1_PHZH_2012_MS1_d30aa072_introduction.txt,Fähigkeit Team arbeiten Wirtschaft zunehmend Bedeutung,1c
1_PHZH_b90a5633_341f812d_d5da8593_b809dc24_4fcd40fc_abd50988_e01a3e09_a63acd73_7a669003_introduction.txt,dritter Leitfrage Kapitel Diskussion Ergebnis beantworten,3g
1_PHZH_4fcd40fc_7a669003_74d8fd0c_22f17b9d_introduction.txt,Arbeit sollen Beitrag verstärkt Integration Fernerkundung Geografieunterricht leisten Lehrperson Orientierungshilfe beurteilen Luftund Satellitenbilder sowie Erarbeit passend Fragestellung,3a
1_PHZH_2014_MS1_9685d328_1df949aa_introduction.txt,Ausbildung Lehrperson Sekundarstuf I gesellschaftlich Thema Disziplin Strafe Schule relevant,1c
1_PHZH_2014_MS1_397b021f_introduction.txt,vielmehr Frage darin liegen Autor Lehrer verändern Arbeitsklima verändern Unterrichtsstörunge Seite her reduzieren,0
1_PHZH_2014_MS1_f89ebf2e_introduction.txt,Leseroutine lässen regelmässig Üben erwerben Nodari Schiesser,0
1_PHZH_2014_MS1_8a45a584_introduction.txt,zeigen Studie Mehrheit siebzig Prozent befragt jugendliche Regel ökologisch korrekt verhalten kennen beispielsweise Müll Wald werfen Tier Ruhe lassen stören Pflanze auszureissen,1e
1_PHZH_af46a886_3beda123_b58d1e70_09717d62_c70fa686_dfcfd993_4fcd40fc_3567c78e_c713876f_0034d060_introduction.txt,Arbeit Anpassung anhand Vorwissenserhebung Kernpunkt,2a
1_PHZH_2014_MS1_8a45a584_introduction.txt,Standard  Heterogenität Lehrperson anerkennen Verschiedenheit Schülerin Schüler bezüglich sozial Herkunft Kultur,0
1_PHZH_2014_MS1_55a86fc5_introduction.txt,Thema zweiter Teil Arbeit beschäftigen dabei liefern Arbeit jedoch explizit Lektionsplanung Rahmen sprengen Erkenntnis Sportunterricht ableiten Anregung Umsetzung Unterricht,0
1_PHZH_2014_MS1_55a2d87e_introduction.txt,folgen Beschreibung Methode Durchführung Untersuchung Kapitel  Darstellung Ergebnis Kapitel  Diskussion Kapitel,3g
1_PHZH_2014_MS1_6c80d44e_introduction.txt,Einführung gewählt Zitat sollen erster Versuch Annäherung benannt Spannungsfeld Problematik aufzeigen Empirie Grund beschäftigen möchten,0
1_PHZH_3f0e91e4_4a97c710_dd8574ec_124b0b6b_4fcd40fc_7a669003_introduction.txt,stattdessen beginnen Schüler Diskussion Thematik Stunde Fach sowieso völlig irrelevant,0
1_PHZH_2014_MS1_f89ebf2e_introduction.txt,Kapitel persönlich Fazit . Dank . bilden Abschluss Kapitel gleichzeitig Schluss Arbeit,3g
1_PHZH_ac9f8553_4fcd40fc_d59f3d3c_904e75e1_7a669003_introduction.txt,beschreiben Fall allerdings Anschluss narrativ Form entlang Fragestellung aufrollen analysieren,3d
1_PHZH_51b58dcc_7d0941f4_56b082fa_7a669003_introduction.txt,Hintergrund erhalten Entwicklung positiv Fehlerkultur Schule Unterricht groß Bedeutung,1c
1_PHZH_607d1004_e01a3e09_a63acd73_7a669003_4fcd40fc_introduction.txt,Rahmen Arbeit untersucht Vietnamkriegsfilm bilden Quellenmaterial Analyse,3e
1_PHZH_2011_MS1_a1ee7fc8_introduction.txt, nehmen Eltern Berufswahlprozess Kind eigen Rolle darin wahr,3b
1_PHZH_2014_MS1_8a45a584_introduction.txt,. Einleitung,0
1_PHZH_2014_MS1_f4fb4cbc_introduction.txt,hierfür Leseprozess detailliert betrachten verschieden Leseansätz aufzeigen,0
1_PHZH_2bb5e5c8_bc3c1032_e01a3e09_4fcd40fc_27c6f769_introduction.txt,nächster Kapitel stehen Zusammenhang Interesse Motivation andererseits Einsatz Film Medienpädagogischen Sicht Thema Film Unterricht Vordergrund,0
1_PHZH_2014_MS1_7db60009_introduction.txt,Ergebnis zeigen wirklich vieler Bild präsent Moment mehrere Autor darstellen vgl. Lieber  Pettersson  Billmayer,0
1_PHZH_c401df5e_c53a9081_4fcd40fc_87e91429_7a669003_6879a159_introduction.txt,abschliessend finden Diskussion statt Ergebnis Bezug Fragestellung zusammenfassend darstellen,3g
1_PHZH_2014_MS1_8a45a584_introduction.txt,vorliegend Arbeit setzen zeitgemäss Umweltbildung auseinander genau Ziel setzen Kompetenz Schülerin Schüler fördern möchten,2a
1_PHZH_2014_MS1_7db60009_introduction.txt,manchmal Weniger mehr neu immer unbedingt gut,0
1_PHZH_2014_MS1_956d232e_introduction.txt,abschliessend diskutieren Ergebnis vergleichen Theorie halten kritisch fest inwiefern aussagekräftig eben erforschen müsster,3g
1_PHZH_2014_MS1_2b75f2b3_introduction.txt,Ergebnis qualitativ Erkenntnis Videoaufnahm Aussage leitfadengestützt Interview verknüpfen,3d
1_PHZH_0e9f5c53_c53a9081_4fcd40fc_87e91429_7a669003_introduction.txt,persönlich Definition Arbeitszufriedenheit sollen dabei erfragen aufschlussreicher Einblick aktuell Zufriedenheit Lehrperson geben sollen,0
1_PHZH_0e9f5c53_c53a9081_4fcd40fc_87e91429_7a669003_introduction.txt,kommend Abschnitt zentral Aspekt Arbeit grösseren thematisch Zusammenhang erörtern,0
1_PHZH_734976d3_08ec7951_c1c21b94_e4075b87_55241912_4fcd40fc_374bed2b_5ffb855c_22657153_790ce245_7a669003_introduction.txt,Multikultur beziehen Unterschiedlichkeit Kultur Standard III X PH Zürich handeln eben Umgang Unterschiedlichkeit Schule,0
1_PHZH_b90a5633_341f812d_d5da8593_b809dc24_4fcd40fc_abd50988_e01a3e09_a63acd73_7a669003_introduction.txt,Hilfe Methode Filmwissenschaft drei gewählt Film entlang Leitfragen analysieren,3d
1_PHZH_b90a5633_341f812d_d5da8593_b809dc24_4fcd40fc_abd50988_e01a3e09_a63acd73_7a669003_introduction.txt,anschliessend Analysemethode Faulstich  Kort  besprechen erklären Analyse Masterarbeit aufbauen verwendet Analyseraster Figurencharakterisierung entstehen,3g
1_PHZH_2014_MS1_1f00be7e_aa2ab8ba_introduction.txt,Rahmen Studiengang Physik Oberstufenlehrperson gross Teil physikalisch Phänomen anhand zahlreich anschaulich Experiment diskutieren,0
1_PHZH_87e91429_c53a9081_4fcd40fc_7a669003_e23e6810_introduction.txt,genau erörtern weit Fragestellung gliedern,0
1_PHZH_607d1004_e01a3e09_a63acd73_7a669003_4fcd40fc_introduction.txt,Problem Veteran Alltag USA zeigen,0
1_PHZH_4fcd40fc_7a669003_74d8fd0c_22f17b9d_introduction.txt,methodisch didaktisch Grundlage Arbeit dienen Konzept verstärkt Integration Fernerkundung insbesondere Luftund Satellitenbilder Geographieunterricht Dr. Reuschenbach,3d
1_PHZH_2014_MS1_1df949aa_9685d328_introduction.txt,Arbeit gliedern vier Teil,3g
1_PHZH_2014_MS1_55a86fc5_introduction.txt,wissenschaftlich Befund Heterogenität jugendliche Lamprecht et al. a  bezüglich sportlich Betätigung Erscheinung Neuzeit bereits seit lang nachweisen,1e
1_PHZH_2014_MS1_2b75f2b3_introduction.txt,empirisch Teil Masterthesis gehen zuerst Methode,3g
1_PHZH_0e7beff5_f226f278_4fcd40fc_ Departement Sekarstufe I_c7296853_introduction.txt,letzter Kapitel zwei Diskussionsbeitrag formulieren anhand Forschungsergebnis Form Diskurs verwerten,3g
1_PHZH_2014_MS1_8a45a584_introduction.txt,Standard  Motivation Interesse Lehrperson verfügen wissen Motivation Interesse,0
1_PHZH_c0c47aac_e01a3e09_a63acd73_4fcd40fc_7a669003_introduction.txt,Anfang Buch er Jahr eher kurz Zeit zweiter Weltkrieg anschliessend folg Jugendroman er /er er Jahr abschliessend Jugendroman letzter zehn Jahr,3e
1_PHZH_2014_MS1_f89ebf2e_introduction.txt,wiederum führen Schwerpunkt Lesekompetenz Bereich sogenannter Informationslesen verschieben Schreiber & Rupp  zitieren Grütz,0
1_PHZH_8881d2aa_ Departement Sekarstufe I_3ee137a2_e01a3e09_introduction.txt,Rosenstone zufolge liegen Potential Film Faktenund detailgetreu Rekonstruktion Vergangenheit vielmehr Vermittlung Bedeutung. Bezüglich Vorwurf Faktenmangel plädieren Toplin  mehr Toleranz,0
1_PHZH_276a5fc3_ed537019_4fcd40fc_dc411c57_a999b01e_ Departement Sekarstufe I_introduction.txt,zweiter Teil . Klasse Sekundarstuf B durchgeführt Schreibprojekt Liebesroman Detail beschreiben,3g
1_PHZH_2014_MS1_540c5e93_introduction.txt,Ausblick Kapitel schliessen Arbeit ab,3g
1_PHZH_2011_MS1_f89749b3_introduction.txt,anschliessend zusammenfassend Form Überblick theoretisch Grundlage Zusammenhang Selbstmanagement Selbstregulation geben Forschung relevant,3g
1_PHZH_607d1004_e01a3e09_a63acd73_7a669003_4fcd40fc_introduction.txt,wiederum Zug fiktional Charakter historisch Spielfilm betonen,0
1_PHZH_2013_MS1_ce28f371_introduction.txt,jung Lehrperson relevant herausfinden Form MI-basiert Methodik Interesse schulisch Thema gewinnen lässt,0
1_PHZH_2014_MS1_0c2a187e_4ba99837_introduction.txt,. Bezug Standard PHZH,0
1_PHZH_2012_MS1_d30aa072_introduction.txt,. Bezug PHZH-Standard,0
1_PHZH_2014_MS1_540c5e93_introduction.txt,Ergebnis Kapitel präsentieren zusammengefasst,3g
1_PHZH_2012_MS1_e868b043_introduction.txt,führen schliesslich Fragestellung Zielsetzung vorliegend Masterarbeit,3b
1_PHZH_b31c481e_81d3dc3c_373d4bbd_b88f304f_33b54baf_9b74fbe3_02062de0_90840986_025d0dab_introduction.txt,quantitativ Analyse Bezug Vorkommnis pro Seitenzahl,3d
1_PHZH_2014_MS1_0c2a187e_4ba99837_introduction.txt,Ziel Arbeit untersuchen Problem Protagonist Spielfilm The Namesake aufgrund Emigration Amerika konfrontieren,3a
1_PHZH_0633597c_9777b73e_4fcd40fc_7a669003_fc19e214_introduction.txt,Lernende Lernziel erreichen Partnerpuzzle-Methode einführen üben anwenden,0
1_PHZH_2014_MS1_be36150e_39435396_introduction.txt,Rahmenbedingung Schulsozialarbeit operieren daraus entstehend Einschränkung Kapitel .. Schulsozialarbeit darstellen,3g
1_PHZH_416b9c70_4fcd40fc_34e280f1_7a669003_a43bb46c_introduction.txt,. Einleitung,0
1_PHZH_2014_MS1_7dc244ae_introduction.txt,vorliegend Arbeit setzen ausführlich Thema integrativ Schulung Kanton Zürich auseinander sollen Chance integrativ Schulung Sportunterricht aufzeigen,3a
1_PHZH_7a669003_b5e98c9a_c7296853_21428f03_introduction.txt,Hilfe Modell deutlich Rolle Selbstwirksamkeit Ess-Brech-Prozess spielen Hilfe therapeutisch Unterstützung gezielt durchbrochen,0
1_PHZH_2014_MS1_84175e88_introduction.txt,Kapitel drei wichtig Konzept Emotionale Intelligenz vorstellen miteinander vergleichen,3g
1_PHZH_2014_MS1_55a86fc5_introduction.txt,Einleitung aufgeführt Studie zeigen Mädchen weniger sportlich aktiv Junge Sportunterricht betreffen,1e
1_PHZH_2014_MS1_81e0174a_introduction.txt,Schluss lassen Ergebnis erster zweiter Teil vergleichen somit Fragestellung beantworten,3d
1_PHZH_87e91429_c53a9081_4fcd40fc_fb1cabbf_ Departement Sekarstufe I_introduction.txt,Bezüglich Schule gerade Übergang Primarschule Oberstufe finden Schweiz Studie schulisch Anforderung ergründen,2c
1_PHZH_2014_MS1_0c2a187e_4ba99837_introduction.txt,Unterlage Planung Vorbereitung Analyse dienten Anhang Arbeit finden,3g
1_PHZH_2014_MS1_562e4ab2_introduction.txt,letzter Teil Arbeit erhalten Testwert sowohl deskriptiv auswerten Signifikanz überprüfen,3g
1_PHZH_574404cd_7a669003_4fcd40fc_0e7dd130_d76c66ea_introduction.txt,Fazit erarbeitet Detailwisse bündeln theoretisch hergeleitet Weg wissen Einstellung mittels Urteilskompetenz aufzuzeigen,3g
1_PHZH_2014_MS1_93f526f5_introduction.txt,Weiter erfolgen Zusammenfassung aktuell Forschungsstand hinsichtlich Übergänge sozial Ungleichheit Bildungssystem speziell Sachlage bezüglich Migrationsthematik Kapitel .,3g
1_PHZH_2f466bfd_4fcd40fc_42ed659e_7a669003_2ca5a840_a729a264_introduction.txt,Berufsentscheid weitreichend Konsequenz Leben entscheiden Gesellschaft integrieren wohlfühlen,0
1_PHZH_2014_MS1_4baa6d00_introduction.txt,Medium spielen heute groß Rolle beeinflussen Alltag Schülerin Schüler,1c
1_PHZH_2014_MS1_1df949aa_9685d328_introduction.txt,zeigen allgegenwertig Thema Disziplin Strafe Schule Lehrperson heute,1c
1_PHZH_2014_MS1_cfcc774c_introduction.txt,Genderkompetenz verstehen,0
1_PHZH_0e9f5c53_c53a9081_4fcd40fc_87e91429_7a669003_introduction.txt,dabei sollen Fokus Interesse Arbeitszufriedenheit stehen,2a
1_PHZH_c53a9081_057a2bfb_4fcd40fc_87e91429_7a669003_introduction.txt,sämtlicher Arbeitsvorgäng hängen zusammen Wirkung Ergebnis erzielen,0
1_PHZH_2014_MS1_5b80a1aa_0b4089f0_introduction.txt,Fragebogen ausgefüllt beabsichtigt herausfinden Motiv jugendliche spielen bringen,3d
1_PHZH_2014_MS1_cf8586bd_introduction.txt,Zusammenhang folgend Fragestellung formulieren,0
