text_id,sentence,label
1_PHZH_2014_MS1_4571ea34_introduction.txt,ableiten englisch Begriff special educational needs,0
1_PHZH_2014_MS1_540c5e93_introduction.txt,verschieden Modell einführen diskutieren,3g
1_PHZH_2014_MS1_0ccb5f81_introduction.txt,darauf folgend Kapitel stellen Spiel Influent Untersuchung verwenden,3g
1_PHZH_2014_MS1_55a86fc5_introduction.txt,Knabe treiben mehr Sport Mädchen,0
1_PHZH_607d1004_e01a3e09_a63acd73_7a669003_4fcd40fc_introduction.txt,Rahmen vorliegend Masterarbeit drei historisch Spielfilm konkret Vietnamkriegsfilm Hollywood vermittelt Bild US-amerikanisch vietnamesisch Figur Darstellung beteiligt Kriegspartei untersuchen,3e
1_PHZH_b63cee49_764f4fe1_1e8ec8a0_d4c16655_introduction.txt,Ziel Projekt herausfinden Lesekompetenz verbessern Schülerin Schüler Unterricht Freizeit Buch lesen,3a
1_PHZH_2014_MS1_55a2d87e_introduction.txt,Zentrum stehen Frage genderuntypisch Berufswahlentscheid zustande kommen statistisch sehen ungewöhnlich Weg untypisch Berufsausbildung erleben,3b
1_PHZH_b31c481e_81d3dc3c_373d4bbd_b88f304f_33b54baf_9b74fbe3_02062de0_90840986_025d0dab_introduction.txt,Kategoriensystem Lehrmittel analysieren Ausprägung verschieden Kategorie bewerten,3d
1_PHZH_c401df5e_c53a9081_4fcd40fc_87e91429_7a669003_6879a159_introduction.txt,gehen berufseinsteigend Lehrperson überdurchschnittlich Belastung respektive resultierend Beanspruchung,0
1_PHZH_0e9f5c53_c53a9081_4fcd40fc_87e91429_7a669003_introduction.txt,sollen deshalb untersuchen Faktor Zufriedenheit beziehungsweise Unzufriedenheit Berufseinstieg beitragen,2a
1_PHZH_c53a9081_057a2bfb_4fcd40fc_87e91429_7a669003_introduction.txt,kommunizieren kontext- Adressatenund aufgabenspezifisch,0
1_PHZH_2014_MS1_956d232e_introduction.txt,Einleitung folgen Theorie Methodik Auswertung Ergebnis Diskussion folgen Literaturverzeichnis Anhang,3g
1_PHZH_2014_MS1_b11a5d4b_040b4719_introduction.txt,. Bedingung müssen befragter erfüllen reibungslos Ablauf Unterricht gewährleisten,3b
1_PHZH_2014_MS1_0c2a187e_4ba99837_introduction.txt,inhaltlich Ergebnis Kapitel auswerten Bezug behandelt Theorie stellen,3g
1_PHZH_2014_MS1_2b75f2b3_introduction.txt,Schümer Tillmann Weiss   verweisen aktuell empirisch Forschung halten fest soweit heterogen homogen zusammengesetzt Lerngruppe miteinander vergleichen kommen meister Autor Ergebnis leistungsschwach Schüler mehr leisten Gruppe gleich schwach Schüler heterogen Gruppe lernen leistungsstarke Schüler homogen Gruppe gleich stark Schüler hoch Leistung erbringen Schümer Tillmann Weiss,1e
1_PHZH_2014_MS1_4baa6d00_introduction.txt,Kern Arbeit bilden Forschungsmethode quantitativ qualitativ Zugang Klasse durchführen,3d
1_PHZH_2014_MS1_956d232e_introduction.txt,häufig rechtfertigen jung Lernende klar wer gut schlecht beispielsweise Giesecke   erwähnen menschlich Gemeinschaft jedoch Zukunft Wissen Erfahrung akkumulieren Zeitkategorie Zukunft kollektiv Größe überhaupt erst wahrnehmen,0
1_PHZH_2014_MS1_81e0174a_introduction.txt,Form wählen Technorama gut Rahmen bieten grösser Anzahl jugendliche herankommen Effekt persönlich Vorliebe Befragung einzeln Schülerin Schüler einschleichen relativieren möglichst breit Spektrum Schülerinnenund Schülermeinung abzubilden,3d
1_PHZH_607d1004_e01a3e09_a63acd73_7a669003_4fcd40fc_introduction.txt,Studie aufgegriffen Bereich Bedeutung vorliegend Masterarbeit,0
1_PHZH_2014_MS1_ab8aad8c_introduction.txt,Fortschritt eigen tun Erfüllung persönlich fremddiktiert Ziel brauchen Mensch Überzeugung erworben Fähigkeit Herausforderung Leben selbständig meistern,0
1_PHZH_0e9f5c53_c53a9081_4fcd40fc_87e91429_7a669003_introduction.txt,abschliessend Schlussteil weiterführend Gedanke Ausblick aufführen Grenze Arbeit diskutieren,3g
1_PHZH_2014_MS1_55a86fc5_introduction.txt,Untersuchung letzter Jahr Schulgesundheitsdienste Stadt Zürich  kommen Ergebnis Junge mehr Sport treiben Mädchen,1e
1_PHZH_734976d3_08ec7951_c1c21b94_e4075b87_55241912_4fcd40fc_374bed2b_5ffb855c_22657153_790ce245_7a669003_introduction.txt,jugendliche positiv beeinflussen ethnisch Akzeptanz kritisch Medienkonsum lernen,0
1_PHZH_0e7beff5_f226f278_4fcd40fc_ Departement Sekarstufe I_c7296853_introduction.txt,gemeinsam ermöglichen Antwort Frage erreichen Zielsetzung,0
1_PHZH_574404cd_7a669003_4fcd40fc_0e7dd130_d76c66ea_introduction.txt,fällen Schüler Schülerinn Urteil,3b
1_PHZH_ac9f8553_4fcd40fc_d59f3d3c_904e75e1_7a669003_introduction.txt,entscheiden Frage Rahmen Fallstudie nachgehen,3d
1_PHZH_2014_MS1_4baa6d00_introduction.txt,Lernende Dilemmasituation anhand einzeln Szene Spielfilm Hitlerjunge Salomon präsentieren Schülerin Schüler anregen sollen Perspektive Dilemmasituation einnehmen eigen Urteil bilden,0
1_PHZH_af46a886_3beda123_b58d1e70_09717d62_c70fa686_dfcfd993_4fcd40fc_3567c78e_c713876f_0034d060_introduction.txt,Manipulation menschlich Embryon heikl Forschung,0
1_PHZH_607d1004_e01a3e09_a63acd73_7a669003_4fcd40fc_introduction.txt,versuchen herauszuarbeit Stelle Film Nähe Figur beide Kriegspartei zulassen,3a
1_PHZH_2014_MS1_397b021f_introduction.txt,Lehrer heute vermehrt Fokus wissenschaftlich Untersuchung,1c
1_PHZH_4fcd40fc_e01a3e09_7a669003_f04d0429_9d7a2722_introduction.txt,schaffen adäquat Lernsituation Kompetenz fördern Lehrmittel bisher üblich verwenden,0
1_PHZH_87e91429_c53a9081_4fcd40fc_7a669003_e23e6810_introduction.txt,theoretisch Teil folgen Fragestellung Kapitel,3g
1_PHZH_c53a9081_057a2bfb_4fcd40fc_87e91429_7a669003_introduction.txt,Forschungsarbeit sollen erster Schritt darum gehen herausfinden Situation Schülerin Schüler Leistungssituation definieren Bereich Alltag vorkommen,2a
1_PHZH_2014_MS1_6c80d44e_introduction.txt,Begriff kritisch Lebensereigniss Betrachtung entwicklungspsychologisch Warte heraus sollen spät Zeitpunkt Begriff Statuspassage eng Fokus geraten,1d
1_PHZH_ac9f8553_4fcd40fc_d59f3d3c_904e75e1_7a669003_introduction.txt,möchten eigen Mobbingfall aufrollen Hand drei Frage beleuchten,3a
1_PHZH_2011_MS1_2352efa7_introduction.txt,zwei Forschungszykle durchführen,3d
1_PHZH_2014_MS1_562e4ab2_introduction.txt,gewonnen Erkenntnis Schlussteil zusammenfassend aufführen daraus möglich Konsequenz Schulalltag ableiten,3g
1_PHZH_4fcd40fc_2ddc90ae_7a669003_c72b17ed_introduction.txt,zweiter Hauptteil Arbeit folgen Beschreibung Durchführung Aktionszykle angewandt Methode sowie Auswertung Vergleich Ende Ergebnis tiefgreifend diskutieren aufschlussreich Fazit ziehen,3g
1_PHZH_2014_MS1_1f00be7e_aa2ab8ba_introduction.txt,Anschluss Ergebnis auswerten Diagramme darstellen abschliessend Diskussion interpretieren,3g
1_PHZH_4fcd40fc_e01a3e09_a43b8048_7a669003_8450ab59_introduction.txt,Grundlage Analyse Methodendesign erarbeiten zwei Sekundarschulklasse praktisch umsetzen,3d
1_PHZH_b63cee49_764f4fe1_1e8ec8a0_d4c16655_introduction.txt,verstehen Schülerin Schüler je Thema Text gut eben,0
1_PHZH_416b9c70_4fcd40fc_34e280f1_7a669003_a43bb46c_introduction.txt,anschliessend Datum Sinn qualitativ Inhaltsanalyse anhand Kategoriensystem Auswertung entlang Interviewleitfaden bilden zuordnen,3d
1_PHZH_9a6754e1_7b92d97d_05fcf6c3_7c3e5fa5_7102dcb4_2ce3aa35_9777b73e_d39e2bb2_60d03c4b_introduction.txt,vorliegend Masterarbeit Autorin herausfinden pädagogisch Konzept handlungsorientiert Unterricht eignen Schülerin Schüler überfachlich Kompetenz fördern,3a
1_PHZH_4fcd40fc_e01a3e09_7a669003_f04d0429_9d7a2722_introduction.txt,dafür drei Lehrmittel Schlussbericht UEK untersuchen Schlussbericht Scharnier fungieren,3d
1_PHZH_ac9f8553_4fcd40fc_d59f3d3c_904e75e1_7a669003_introduction.txt,möchten zweiter Ziel Lehrperson Mobbing reagieren allgemein beleuchten erörtern wer spezifisch Fall helfen folglich tun ähnlich Fall auftreten sollen,3a
1_PHZH_ac9f8553_4fcd40fc_d59f3d3c_904e75e1_7a669003_introduction.txt,• gehen Lehrperson Fall Mobbing gut,3b
1_PHZH_276a5fc3_ed537019_4fcd40fc_dc411c57_a999b01e_ Departement Sekarstufe I_introduction.txt,Kapitel befassen Schreiben mental Prozess beginnend drei Schreibphase Plan Formulier Überarbeit Text üblicherweise durchläuft,3g
1_PHZH_2014_MS1_1f00be7e_aa2ab8ba_introduction.txt,Alltagsbezug schaffen womit Standard  Motivation Interesse verknüpfen lässn,0
1_PHZH_0e7beff5_f226f278_4fcd40fc_ Departement Sekarstufe I_c7296853_introduction.txt,ermöglichen orientierend Ausblick Kapitel,0
1_PHZH_51b58dcc_7d0941f4_56b082fa_7a669003_introduction.txt,sollen Fehler Schritt Verstehens-Prozess akzeptieren gegenseitig Verarbeitung unterstützen beschämen,0
1_PHZH_838eb8a3_4fcd40fc_ Departement Sekarstufe I_a665daa3_9a79bf39_introduction.txt,Heterogenität Arbeit Unterschiedlichkeit Individuum verstehen,1d
1_PHZH_4fcd40fc_09a8ec4a_ Departement Sekarstufe I_a6ac235e_d435f07a_introduction.txt,vieler Fach erhalten Schülerin Schüler Aufgabe Textform schriftlich Auftrag beispielsweise Schülerin Schüler Text lesen müssen schriftlich Anweisung erhalten Prüfung schreiben müssen,0
1_PHZH_2014_MS1_53b4b6ca_introduction.txt,Ziel Arbeit a zeigen theoriegeleitet Praxis oft empirisch Wirksamkeit Lehrhandeln berücksichtigen  wirksam st  Faktor lernwirksam Lehrhandeln darstellen Bedeutung erfolgreich lernen erläutern sowie c Notwendigkeit aufzuzeigen lernwirksam Lehrhandel Rahmen Ausbildung Lehrperson intensiv trainieren,3a
1_PHZH_2014_MS1_7dc244ae_introduction.txt,Arbeit zwei Hauptbereiche gliedern,3g
1_PHZH_2014_MS1_b11a5d4b_040b4719_introduction.txt,Gleichermasse müssen Schülerin Schüler fit for Life,0
1_PHZH_2014_MS1_7db60009_introduction.txt,deshalb Theorieteil ebenfalls besprechen,0
1_PHZH_9bb4c1ff_cb53f07d_9ea67f3f_7a669003_introduction.txt,gewonnen wichtig Erkenntnis Fazit nochmals aufzeigen,3g
1_PHZH_4fcd40fc_e01a3e09_7a669003_f04d0429_9d7a2722_introduction.txt,wegen eng Wechselwirkung Inhalt Geschichtslehrmittel Historiographie sollen kurz Abriss Entwicklung Geschichtsschreibung Geschichtsbilder erst verdeutlichen gesellschaftlich Kontext stellen,0
1_PHZH_8a10f9ae_e23bf532_4fcd40fc_57c4b296_6c2cf7e3_7a669003_introduction.txt,Untersuchung unterstehen somit Forschungsfrage Veränderung Projektentwurf vornehmen sollen fachlich korrekt effektiv Unterrichtskonzept herstellen gesetzt Ziel gut erreichen,3b
1_PHZH_8a10f9ae_e23bf532_4fcd40fc_57c4b296_6c2cf7e3_7a669003_introduction.txt,Schlussteil fassen wichtig Ergebnis nochmals zusammen geben darauf basierend Ausblick,3g
1_PHZH_ba40faf0_668b7cec_7a669003_4fcd40fc_introduction.txt,theoretisch Grundlage Konzept kooperativ Lernen Ausgangslage Klasse führen konkret Fragestellung inwiefern kooperativ Lernform dienen Lernatmosphäre verbessern individuell Bedürfnis Schülerin Schüler gerecht,3b
1_PHZH_2014_MS1_63819ad4_e673af8f_introduction.txt,Ausbildung Vielzahl unterschiedlich didaktisch Ansicht Ansatz kennenlernen,0
1_PHZH_8a10f9ae_e23bf532_4fcd40fc_57c4b296_6c2cf7e3_7a669003_introduction.txt,Masterarbeit handeln empirisch Literaturarbeit Entwicklungsteil qualitativ Zugang Prorektorat Ausbildung Abteilung Sekundarstufe   S.,3d
1_PHZH_2013_MS1_ce28f371_introduction.txt,übergeordnet Ziel Arbeit Methodenrepertoir erweitern Schülerin Schüler Förderung Intelligenz-Veranlagung bedürfnisgerechter Unterricht erfahren,3a
1_PHZH_51b58dcc_7d0941f4_56b082fa_7a669003_introduction.txt,Kapitel fassen wichtig theoretisch Aspekt Erkenntnis vorliegend Unterrichtsforschung zusammen schliessen Ausblick ab,3g
1_PHZH_2014_MS1_040b4719_b11a5d4b_introduction.txt,Vorstellung kompatibel verschieden weshalb,3b
1_PHZH_2014_MS1_7db60009_introduction.txt,Diskussion schauen Tellerrand hinaus Erhebung zusätzlich Unterschied Lehrbücher herauskristallisieren,0
1_PHZH_2011_MS1_2352efa7_introduction.txt,Punkt knüpfen Arbeit sollen aufzeigen sozial positiv Verstärkern herausfordernd Lernende Fall Knabe namens Claudio erreichen,3a
1_PHZH_4fcd40fc_7a669003_74d8fd0c_22f17b9d_introduction.txt,theoretisch Teil Aspekt vertiefen eingehen Beurteilung Schwierigkeit Luftund Satellitenbilder sowie dazugehörig Auftrag essenziell,3g
1_PHZH_01491c28_4fcd40fc_6ab73ff2_c7296853_ Departement Sekarstufe I_introduction.txt,danach folgen Präsentation wichtig Ergebnis Befragung Kap .,3g
1_PHZH_8a10f9ae_e23bf532_4fcd40fc_57c4b296_6c2cf7e3_7a669003_introduction.txt,Seith & Kaveman  S.  Ansicht  Arbeit häuslich Gewalt betroffen Kind anspruchsvoll  deshalb erfahren Personal notwendig [ ],0
1_PHZH_276a5fc3_ed537019_4fcd40fc_dc411c57_a999b01e_ Departement Sekarstufe I_introduction.txt,Kapitel erfolgen schliesslich Ausblick weiterführend Forschungsgebiete Masterarbeit aufbauen,3g
1_PHZH_3f0e91e4_4a97c710_dd8574ec_124b0b6b_4fcd40fc_7a669003_introduction.txt,zweiter Teil Arbeit strukturtheoretisch systemtheoretisch interaktionistisch Professionstheorie Hinblick Fragestellung Arbeit Gestaltung Verhältnis Theorie Praxis innerhalb soziologisch Professionalisierungstheorie Konsequenz Berufseinstieg eingehend untersuchen,3g
1_PHZH_0633597c_9777b73e_4fcd40fc_7a669003_fc19e214_introduction.txt,zweiter Teil folgen Klärung Methodik,3g
1_PHZH_2014_MS1_8a45a584_introduction.txt,abschliessend letzter Kapitel Arbeit nochmals wichtig Erkenntnis zusammengefasst Bezug Forschungsfrage Zielsetzung Arbeit diskutieren,3g
1_PHZH_b63cee49_764f4fe1_1e8ec8a0_d4c16655_introduction.txt,Kern Arbeit beginnen Kapitel  erforderlich theoretisch Grundlage Leseverstehen Lesekompetenz extensiv fremdsprachlich Lese vorstellen,3g
1_PHZH_2014_MS1_b11a5d4b_040b4719_introduction.txt,besonders interessant erscheinen Befragung Erziehungsberechtigt Einfluss Zusammenhang Diskussion pädagogisch Frage vernachlässigen,3d
1_PHZH_87e91429_c53a9081_4fcd40fc_fb1cabbf_ Departement Sekarstufe I_introduction.txt,Abschluss bilden Kapitel Zukunftsperspektive weiterführend Frage Arbeit ergeben erläutern,3g
1_PHZH_51b58dcc_7d0941f4_56b082fa_7a669003_introduction.txt,Kapitel Methode Aktionsforschung vorstellen Durchführung vorliegend Arbeit konkretisieren,3g
1_PHZH_2012_MS1_e868b043_introduction.txt,selber Stelle weisen Autor zudem darauf Motivationsabhängigkeit Aufmerksamkeitsund Konzentrationsleistung kaum erforschen,2c
1_PHZH_2014_MS1_53b4b6ca_introduction.txt,Lehrperson nunmehr Lernbegleiter Lerncoach,0
2_PHZH_e01a3e09_5532d6a2_d7c2cc9e_a63acd73_1e8ec8a0_4fcd40fc_adebc6e6_introduction.txt,basiswissen Schüler,0
1_PHZH_2bb5e5c8_bc3c1032_e01a3e09_4fcd40fc_27c6f769_introduction.txt,Teil abschliessend Erhebung qualitativ Teil quantitativ auswerten,3d
1_PHZH_b63cee49_764f4fe1_1e8ec8a0_d4c16655_introduction.txt,zudem extensiv Lese Einstellung gegenüber fremdsprachlich Lese positiv beeinflussen Elley & Mangubhai  Hafiz & Tudor  Tudor & Hafiz  Robb & Susser  Elley  Cho & Krashen  Rodrigo  Mason & Krashen  Leung  Hitosugi & Day,0
1_PHZH_734976d3_08ec7951_c1c21b94_e4075b87_55241912_4fcd40fc_374bed2b_5ffb855c_22657153_790ce245_7a669003_introduction.txt,Weg erwähnt Ziel Kapitel . Multikulturelle interkulturell transkulturell Gesellschaft beschreiben Zusammenleben verschieden Ethnie bedeuten warum schwierig benötigen funktionieren,3g
1_PHZH_c53a9081_057a2bfb_4fcd40fc_87e91429_7a669003_introduction.txt,liegen Fokus Einfluss Lehrperson,2a
1_PHZH_2014_MS1_8a45a584_introduction.txt,theoretisch Teil umfassen Herleitung Begriff zeitgemässe Umweltbildung Bildung Nachhaltiger Entwicklung,3g
1_PHZH_b31c481e_81d3dc3c_373d4bbd_b88f304f_33b54baf_9b74fbe3_02062de0_90840986_025d0dab_introduction.txt,Arbeit untersuchen somit Inhalt zwei meistgenannt Lehrmittel Bildungsdirektione Schweiz irisch Lehrmittel,3e
1_PHZH_4fcd40fc_2ddc90ae_7a669003_c72b17ed_introduction.txt,anschliessend Zielsetzung Vorgehensweise Aufbau Arbeit aufzeigen,3g
1_PHZH_b31c481e_81d3dc3c_373d4bbd_b88f304f_33b54baf_9b74fbe3_02062de0_90840986_025d0dab_introduction.txt,verwendet Codesystem Auswertung vorstellen bevor Teil Forschungsmethode genau durchleuchten,0
1_PHZH_2014_MS1_7db60009_introduction.txt,Arbeit sollen untersuchen Bezug Bild Natur-undTechnik-Lehrmitteln stehen,3a
1_PHZH_2014_MS1_562e4ab2_introduction.txt,danach Zusammenhang Bewegung kognitiv Leistung aufzeigen,3g
1_PHZH_09a8ec4a_e416c7c8_99ad174e_introduction.txt,zweiter Teil beschäftigen inwiefern dargestellt Schulmodell beschrieben Vertrauensverhältnis Schüler innen Lehrperson begünstigen verhindern,3g
1_PHZH_607d1004_e01a3e09_a63acd73_7a669003_4fcd40fc_introduction.txt,Bereich handeln z.B. Fachwissenschaft Denkmalpflege Schulunterricht weitern,0
1_PHZH_2014_MS1_f89ebf2e_introduction.txt,Kapitel praktisch Teil darstellen,3g
1_PHZH_9ea67f3f_4fcd40fc_3de4c84d_c4f67cb5_7a669003_introduction.txt,zudem erhoffen Schülerin Schüler Handelnde Veränderung bemerken,3a
1_PHZH_575b52ea_4fcd40fc_a72390b6_ Departement Sekarstufe I_introduction.txt,Schwerpunkt Interviewleitfade bilden Thema Motivation wohlbefinden Beziehung Leistung Schulmodell allgemein,0
1_PHZH_2014_MS1_9685d328_1df949aa_introduction.txt,anschliessend folgen zweiter theoretisch Teil Kapitel II zuerst Empfindung Wahrnehmung Gerechtigkeit Ungerechtigkeit beschäftigen beide fortwährend verknüpfen,3g
1_PHZH_2014_MS1_9685d328_1df949aa_introduction.txt,abschliessend kurz Überblick Aufbau Arbeit aufführen,0
1_PHZH_c53a9081_057a2bfb_4fcd40fc_87e91429_7a669003_introduction.txt,Beantwortung Forschungsfrag Empirie narrativ Interview vier Schülerin Schüler auswerten sollen Antwort Forschungsfrag finden Methode narrativ Interview Funktionstüchtigkeit überprüfen,3d
1_PHZH_af46a886_3beda123_b58d1e70_09717d62_c70fa686_dfcfd993_4fcd40fc_3567c78e_c713876f_0034d060_introduction.txt,Prüfung zeigen Wissensstand Lernende,0
1_PHZH_2014_MS1_2b75f2b3_introduction.txt,Geld Bildung zusprechen sollen möglichst gross Nutzt bringen,0
1_PHZH_51b58dcc_7d0941f4_56b082fa_7a669003_introduction.txt,Ziel Kooperation gemeinsam geteilt Verständnis Situation Erarbeitung gemeinsam Lösung,0
1_PHZH_2014_MS1_7db60009_introduction.txt,daraus ergeben letzter Fragestellung Fragestellung  Illustrationspraxis Bezug Bildfunktion Vergleich alt neu Lehrbücher verändern,3b
1_PHZH_2014_MS1_b11a5d4b_040b4719_introduction.txt,Schlüsse müssen Schulgeschehen beteiligter einverstanden erst Kooperation Veränderung ermöglichen Frage,0
1_PHZH_87e91429_c53a9081_4fcd40fc_7a669003_e23e6810_introduction.txt,Images schliessen jedoch immer Persönlichkeitsfaktor,0
1_PHZH_244db2a8_e31c8aa4_7a669003_4fcd40fc_introduction.txt,theoretisch Teil vier Themengebieter genau beleuchten Thematik wichtig Aktuelles Verständnis lernen Lehre Individualisierung & Differenzierung selbstgesteuert lernen altersdurchmischt lernen,3g
1_PHZH_59a90fd8_4fcd40fc_5327f408_ Departement Sekarstufe I_437a0090_introduction.txt,verschieden Studie zeigen sowohl computer-­‐basierte Instruktion computer-­‐basiertes Training Mathematikunterricht positiv Einfluss Lernerfolg,1e
1_PHZH_2014_MS1_55a2d87e_introduction.txt,Bildungssystem vorerst strukturell Bedingung rund Übergang Sekundarstufe I Sek I Sekundarstuf II Sek II skizzieren Kapitel .,3g
1_PHZH_2012_MS1_d30aa072_introduction.txt,Kooperation Partizipation sozial Umfeld spielen dabei zentral Rolle,1c
1_PHZH_838eb8a3_4fcd40fc_ Departement Sekarstufe I_a665daa3_9a79bf39_introduction.txt,Bildungssystem beide Land Heterogenität umgehen nächster Kapitel  klären,3g
1_PHZH_b31c481e_81d3dc3c_373d4bbd_b88f304f_33b54baf_9b74fbe3_02062de0_90840986_025d0dab_introduction.txt,neu Codesystem Arbeit klar ursprünglich Kategoriensystem unterscheiden Lehrmittel Inhalt analysieren,3d
1_PHZH_9ea67f3f_4fcd40fc_3de4c84d_c4f67cb5_7a669003_introduction.txt,strukturiert arbeiten Umsetzung Kochrezept fragen gehören Grundkompetenzen Fach fragen,0
1_PHZH_2014_MS1_8a45a584_introduction.txt,darauffolgend Kapitel Ergebnis ausgewertet Datum präsentieren,3g
1_PHZH_276a5fc3_ed537019_4fcd40fc_dc411c57_a999b01e_ Departement Sekarstufe I_introduction.txt,• Wirkung Schreibprojekt Schreibmotivation Schülerin Schüler,3b
1_PHZH_2014_MS1_17ccf0d6_introduction.txt,Weit Transkription Regel erklären,0
1_PHZH_b31c481e_81d3dc3c_373d4bbd_b88f304f_33b54baf_9b74fbe3_02062de0_90840986_025d0dab_introduction.txt,Arbeit beschränken darauf aufgrund Codesystem Inhalt Lehrpläne berücksichtigen Lehrmittel Inhalt analysieren,2a
1_PHZH_6b465eca_30c6c83d_2bb5e5c8_introduction.txt,daher stellen folgend Leitfrage grundlegend Verständnis Verhältnis Zusammenarbeit liegen Akteur,0
1_PHZH_4fcd40fc_e01a3e09_a43b8048_7a669003_8450ab59_introduction.txt,dafür historisch Spielfilm - Eroberung Paradieses Leben Christoph Kolumbus porträtieren wählen,3e
1_PHZH_b63cee49_764f4fe1_1e8ec8a0_d4c16655_introduction.txt,Kapitel verwendet Material Ablauf beide Aktionszykle erläutern Auswertungsmethod vorstellen,3g
1_PHZH_2014_MS1_ab063590_introduction.txt,leitend dabei folgend Fragestellung unterstützen . Schuljahr Schreibauftrag Lehrmittel Sprachwelt deutsch schreibschwach jugendliche Schreibprozess,3b
1_PHZH_575b52ea_4fcd40fc_a72390b6_ Departement Sekarstufe I_introduction.txt,Arbeit schliessen Ausblick weit interessant Untersuchungsmöglichkeit ab,3g
1_PHZH_2014_MS1_562e4ab2_introduction.txt,nächster Schritt darlegen wieso Untersuchung getesteen Wert Aufmerksamkeit  Konzentration Grundpfeiler schulisch Lernen,3g
1_PHZH_2014_MS1_be36150e_39435396_introduction.txt,Kapitel . Diskussion zuvor erwähnt Theorieaspekt Aussage Interview Verbindung bringen,3g
1_PHZH_2014_MS1_8d8dd7fa_introduction.txt,dabei unterscheid linienorientieren Datenmodelle flächenorientiert Datenmodell,0
1_PHZH_b90a5633_341f812d_d5da8593_b809dc24_4fcd40fc_abd50988_e01a3e09_a63acd73_7a669003_introduction.txt,historisch Spielfilm erzählen Geschichte zweiter Mal  Schillinger  S.,0
1_PHZH_2014_MS1_2bbf72a7_introduction.txt,Anschluss daran folgen Kapitel . Ausführung Mehrwert interschulisch Wettkämpfe Voraussetzung sowie Diskussion Schwierigkeit interschulisch Wettkämpfe,3g
1_PHZH_2014_MS1_1df949aa_9685d328_introduction.txt,beinahe unzählig Literatur Frage wann gestraft sollen dürfen beschäftigen finden wenig Effekt Strafe weniger wann Schülerin Schüler Strafe gerecht ungerecht wahrnehmen umgehen,2c
1_PHZH_9bb4c1ff_cb53f07d_9ea67f3f_7a669003_introduction.txt,empirisch Teil Arbeit folgen praktisch Auseinandersetzung Umsetzung theoretisch Grundlage Unterrichtspraxis,3g
1_PHZH_2014_MS1_6c80d44e_introduction.txt,Vorgehensweise erster Schritt intern Forschungsergebnis PHZH Thema frühzeitig Berufseintritt untersuchen,3d
1_PHZH_2014_MS1_93f526f5_introduction.txt,schliesslich Kapitel . aufzeigen hinsichtlich Datenerhebung d.h. Sampling Feldzugang Erarbeitung Datenerhebungsinstrumente Datenerhebung vorgehen,3g
1_PHZH_0e7beff5_f226f278_4fcd40fc_ Departement Sekarstufe I_c7296853_introduction.txt,verwendet Methode explizieren Explikandum Rassismustheorien Explikat,3d
1_PHZH_af46a886_3beda123_b58d1e70_09717d62_c70fa686_dfcfd993_4fcd40fc_3567c78e_c713876f_0034d060_introduction.txt,didaktisch Teil folgen Biologischer,3g
1_PHZH_2014_MS1_9685d328_1df949aa_introduction.txt,Kapitel III erfolgen Auseinandersetzung Thema negativ Sanktion Strafe,3g
1_PHZH_607d1004_e01a3e09_a63acd73_7a669003_4fcd40fc_introduction.txt,Naheliegend Einsatz Spielfilm Geschichtsunterricht eingehen,0
1_PHZH_2014_MS1_55a86fc5_introduction.txt,hoch Spassfaktor beide Geschlechtern etwa gleich wichtig,0
1_PHZH_2014_MS1_93f526f5_introduction.txt,liegen gesellschaftlich wirtschaftlich Interesse gesamt Potenzial zukünftig Arbeitskraft ausnutzen,0
1_PHZH_276a5fc3_ed537019_4fcd40fc_dc411c57_a999b01e_ Departement Sekarstufe I_introduction.txt,Kapitel beschäftigen individuell Fortschritt Schülerin Schüler Schreibprojekt,3g
1_PHZH_b31c481e_81d3dc3c_373d4bbd_b88f304f_33b54baf_9b74fbe3_02062de0_90840986_025d0dab_introduction.txt,verschieden Deutschschweizer Kantone Lehrmittelliste Lehrperson analysieren zusammen Befragung Lehrperson zwei Meistgenannte eruiern,3d
1_PHZH_838eb8a3_4fcd40fc_ Departement Sekarstufe I_a665daa3_9a79bf39_introduction.txt,Fragestellung entnehmen befassen vorliegend Untersuchung Sekundarstufe I Klasse Siebt Neunte,3e
1_PHZH_7a669003_b5e98c9a_c7296853_21428f03_introduction.txt, cid: Teil II zweiter Teil zeigen Anwendung Theorie erwartet Selbstwirksamkeit psychisch Störung Bulimie,3g
1_PHZH_2014_MS1_81e0174a_introduction.txt,Anhin beweisen Ziel Arbeit,3a
1_PHZH_2014_MS1_b8f81872_introduction.txt,Arbeit drei Hauptteil gliedern,3g
1_PHZH_2014_MS1_4ba99837_0c2a187e_introduction.txt,letzter Unterkapiteln Begriff Kultur eingehen verschieden Kulturkonzept einander genübergestellen schlussendlich erläutern wer interkulturell Kompetenz verstehen,3g
1_PHZH_2014_MS1_4baa6d00_introduction.txt,Anschluss Holocaust dazugehörig Akteur historisch Perspektive besprechen Behandlung Holocaust Unterricht pädagogisch Konzept empfehlen Rolle arbeiten,3g
1_PHZH_2012_MS1_e868b043_introduction.txt,Schlussfolgerunge selber Arbeit ziehen Konsequenz demnach Unterrichtsgestaltung ergeben Sinn Empfehlung Kollegin Kollege Ergebnis Reflexion abschliessend letzter Teil,3g
1_PHZH_af46a886_3beda123_b58d1e70_09717d62_c70fa686_dfcfd993_4fcd40fc_3567c78e_c713876f_0034d060_introduction.txt,Evaluation drei Untersuchung,3d
1_PHZH_4fcd40fc_e01a3e09_a43b8048_7a669003_8450ab59_introduction.txt,Film -Die Eroberung Paradieses zentral Konzipierung Durchführung Untersuchungsdesign sollen Analyse unterziehen,0
1_PHZH_c0c47aac_e01a3e09_a63acd73_4fcd40fc_7a669003_introduction.txt,Schluss Fragestellung beantworten These bestätigen beziehungsweise widerlegen,3g
1_PHZH_2014_MS1_55a86fc5_introduction.txt,Studie zeigen Frau prinzipiell weniger sportlich aktiv Mann Studie Sport Schweiz  Lamprecht et al. b landesweit Umfrage Sportverhalten Schweizer Bevölkerung beschäftigen,1e
1_PHZH_607d1004_e01a3e09_a63acd73_7a669003_4fcd40fc_introduction.txt,weiss heute allgemein wenig Wirkung Spielfilm Schülerin Schüler,2c
1_PHZH_8881d2aa_ Departement Sekarstufe I_3ee137a2_e01a3e09_introduction.txt,Gelegenheit Masterarbeit nutzen vertiefen Thema auseinander setzen seit Jahrzehnt Brennpunkt Berichterstattung westlich Medium gehören,1c
