text_id,sentence,label
1_PHZH_8a10f9ae_e23bf532_4fcd40fc_57c4b296_6c2cf7e3_7a669003_introduction.txt,beabsichtigen Mithilfe Experte innen authentisch glaubwürdig Unterrichtsprojekt generieren schulisch Alltag Nutzen,3a
1_PHZH_2bb5e5c8_bc3c1032_e01a3e09_4fcd40fc_27c6f769_introduction.txt,Methode Empirische Arbeit qualitativ Zugang wählen,3d
1_PHZH_0e9f5c53_c53a9081_4fcd40fc_87e91429_7a669003_introduction.txt,folgend sollen erkenntnisleitend Fragestellung Arbeit aufführen,3b
1_PHZH_6b465eca_30c6c83d_2bb5e5c8_introduction.txt,institutionalisiert Angebot Seite Schule vorhanden Konflikt vorbeugen,0
1_PHZH_2014_MS1_1df949aa_9685d328_introduction.txt,anschliessend folgen zweiter theoretisch Teil Kapitel II zuerst Empfindung Wahrnehmung Gerechtigkeit Ungerechtigkeit beschäftigen beide fortwährend verknüpfen,3g
1_PHZH_87e91429_c53a9081_4fcd40fc_7a669003_e23e6810_introduction.txt,aufgrund neu Erkenntnis Keller-Schneider  danach verschieden Belastungstype erläutern,0
1_PHZH_574404cd_7a669003_4fcd40fc_0e7dd130_d76c66ea_introduction.txt,danach Forschungsdesign erläutern,3g
1_PHZH_574404cd_7a669003_4fcd40fc_0e7dd130_d76c66ea_introduction.txt,zudem Kompetenzorientierung Schulunterricht spätestens Einführung Lehrplan Sommer übergeordnet Bedeutung,1c
1_PHZH_b31c481e_81d3dc3c_373d4bbd_b88f304f_33b54baf_9b74fbe3_02062de0_90840986_025d0dab_introduction.txt,Art Entstehung Codesystem Methodenteil ausführen,3g
1_PHZH_87e91429_c53a9081_4fcd40fc_7a669003_e696c4b9_introduction.txt,erster Teil theoretisch Grundlage anschliessend Forschung legen,3g
1_PHZH_2014_MS1_540c5e93_introduction.txt,ausgehend dargestellt drei Argument bestehen Ziel vorliegend Untersuchung darin Liste Kompetenz hervorzubringen Situation Schulreise Klassenlager zuschneiden,3a
1_PHZH_8881d2aa_ Departement Sekarstufe I_3ee137a2_e01a3e09_introduction.txt,schreiben deutsch Geschichtswissenschaft zwingen Herausforderung stellen  Ort Nationalsozialismus deutsch Geschichte bestimmen,0
1_PHZH_2012_MS1_d30aa072_introduction.txt,Zeitpunkt Arbeit verfassten unterrichten B-Klasse Anliegen Tendenz entgegensetzen,0
1_PHZH_2014_MS1_6c80d44e_introduction.txt,Fokus biographisch Motiv frühzeitig Berufseinsteiger legen anhand Methode Sequenzanalyse Interviewmaterial analysieren,2a
1_PHZH_2014_MS1_540c5e93_introduction.txt,Frage beantworten erfolgen Kapitel Analyse Klärung Begriff Schulreise Klassenlager,3g
1_PHZH_87e91429_c53a9081_4fcd40fc_fb1cabbf_ Departement Sekarstufe I_introduction.txt,anhin vieler Gebiet hinsichtlich Entwicklungsaufgab untersuchen,1e
1_PHZH_2014_MS1_be36150e_39435396_introduction.txt,ebenfalls Thema Resilienz eingehen bestimmt Faktor Kind jugendliche suchtbelastet Familie ermöglichen unbeschadet Aufzuwachse sehen Kapitel .. Resilienz,3g
1_PHZH_8a10f9ae_e23bf532_4fcd40fc_57c4b296_6c2cf7e3_7a669003_introduction.txt,Punkt Arbeit Hilfe Experte innen absichern,0
1_PHZH_9bb4c1ff_cb53f07d_9ea67f3f_7a669003_introduction.txt,vierter Kapitel Methode Unterrichtsüberprüfung aufzeigen,3g
1_PHZH_607d1004_e01a3e09_a63acd73_7a669003_4fcd40fc_introduction.txt,drei historisch Spielfilm Vietnamkrieg vermitteln Geschichtsbilder Konflikt stehen Zentrum Interesse Arbeit,2a
1_PHZH_2014_MS1_4baa6d00_introduction.txt,weiteren Untersuchung auswerten,3g
1_PHZH_ad8c7b24_d9f2f379_7a669003_4fcd40fc_introduction.txt,zweiter empirisch Teil Eingang Bezug nehmen Aktionsforschung Forschungsmethod,3g
1_PHZH_9ea67f3f_4fcd40fc_3de4c84d_c4f67cb5_7a669003_introduction.txt,•Mit Lesestrategien Lesetechniken Leseverstehen Haushaltkundeunterricht verbessern,3b
1_PHZH_2014_MS1_7db60009_introduction.txt,Ziel Arbeit Lesend vielleicht angehend Lehrperson nachher Grundwissen verfügen differenziert Einsatz Bild Bewerten Lernmaterialie Bezug Bild anregen dabei unterstützen,3a
1_PHZH_7a669003_b5e98c9a_c7296853_21428f03_introduction.txt,thematisch Rahmen generieren Aufbau Arbeit folgendermassen  cid: nachdem Stelle Inhalt Arbeit einführen Kapitel ‚ Fragestellung Methode ‘ zentral Fragestellung sowie Methodik Beantwortung Frage erläutern,3g
1_PHZH_2014_MS1_b11a5d4b_040b4719_introduction.txt,Zusammenhang Fokus Selbstständigkeit Selbstverantwortung legen,2a
1_PHZH_2014_MS1_f4fb4cbc_introduction.txt,Wortspiel bekannt Aphorismus learning by doing zufällig Lesen Arbeit besonderer Stellenwert beimessen,1c
1_PHZH_2014_MS1_1f00be7e_aa2ab8ba_introduction.txt,Vergleich zweiter Schritt Realexperiment Experimentiermaterial durchführen Aspekt Hantieren Hilfsmittel genau untersuchen,3d
1_PHZH_2014_MS1_f89ebf2e_introduction.txt,vorliegend Arbeit Aktionsforschung durchführen,3d
1_PHZH_2014_MS1_cf8586bd_introduction.txt,genau Kenntnis Lehrperson sozial Umfeld SuS gut Umgang Heterogenität unabdingbar,0
1_PHZH_2014_MS1_4571ea34_introduction.txt,Schule bestimmt Kriterium auswählen Konzept sonderpädagogisch Massnahm analysieren,3d
1_PHZH_b90a5633_341f812d_d5da8593_b809dc24_4fcd40fc_abd50988_e01a3e09_a63acd73_7a669003_introduction.txt,Methodischer Zugang vorliegend Masterarbeit handeln qualitativ Forschungsarbeit,3d
1_PHZH_2014_MS1_55a86fc5_introduction.txt,zeigen Wydra  empirisch Studie Saarland Beliebtheit Fach Sport zunehmend Alter besonders Mädchen deutlich klein,1e
1_PHZH_2012_MS1_e868b043_introduction.txt,interessiert Rahmen Unterrichtsforschung Auswirkung täglich kurz musizieren unmittelbar etwa drei Stunde Veränderung feststellbar relativ kurz Dauer täglich musikalisch Unterrichtseinstiege etwa zwei Woche,3a
1_PHZH_2014_MS1_6c80d44e_introduction.txt,Liegen Entscheidung Grundinteress Einkommen möglich Motiv Entscheidung biographisch Entwicklungsverlauf einzeln Fall festmachen,3b
1_PHZH_2014_MS1_55a2d87e_introduction.txt,Grundlage empirisch Untersuchung Arbeit bilden Bourdieu Konzept Habitus sozial Raum,0
1_PHZH_2014_MS1_4baa6d00_introduction.txt,Forschungsteil zunächst Arbeit konzipiert Untersuchungsdesign einführen Ablauf Studie erläutern,3g
1_PHZH_2014_MS1_74c9a371_introduction.txt,Klasse bestehen Schüler Schülerin davon C-Schüler zwei davon ISR Status B-Schülerin eventuell Asperger Syndrom besonders betreuen,0
1_PHZH_2014_MS1_1f00be7e_aa2ab8ba_introduction.txt,genauso interessiert pädagogisch Aspekt Sicht Hantieren Handlungsdimension,0
1_PHZH_4fcd40fc_09a8ec4a_ Departement Sekarstufe I_a6ac235e_d435f07a_introduction.txt,somit meistens lang Text Buch englisch Sprache vermeiden selten Schülerin Schüler meistens . Schuljahr A-Klassen behandeln,0
1_PHZH_2014_MS1_b11a5d4b_040b4719_introduction.txt,. Lehrperson Eltern einverstanden Entwicklung Schule individualisierend System,3b
1_PHZH_2014_MS1_4571ea34_introduction.txt,Begriff Integration bedeuten reformpädagogisch Gesichtspunkt kooperativ Tätigkeit Kollektiv lehrenden gleich Weise Lernende einbeziehen  FEUSER,1d
1_PHZH_c401df5e_c53a9081_4fcd40fc_87e91429_7a669003_6879a159_introduction.txt,zweitens geben bestimmt Berufsfelddefinition selbstauferlegten Standesregel beinhalten,1d
1_PHZH_c401df5e_c53a9081_4fcd40fc_87e91429_7a669003_6879a159_introduction.txt,Ziel mehr spezifisch Belastung erfahren übergeordnet Anliegen bestehen darin herausfinden Freude Beruf Berufseinstieg erhalten,3a
1_PHZH_2014_MS1_4ba99837_0c2a187e_introduction.txt,dabei Begriff Migration Assimilation Sozialisation klären Kontext Migration erläutern,0
1_PHZH_4fcd40fc_09a8ec4a_ Departement Sekarstufe I_a6ac235e_d435f07a_introduction.txt,extensiv Lese Englischunterricht praktizieren,3b
1_PHZH_8a10f9ae_e23bf532_4fcd40fc_57c4b296_6c2cf7e3_7a669003_introduction.txt,dabei legen dar Idee Projekt gelangen Theorie Überlegung Konzept basieren,0
1_PHZH_2014_MS1_0ccb5f81_introduction.txt,Schritt bezweckt aufzuzeigen versprochen Faktor Spiel Merkmal gut Unterricht übereinstimmen positiv Effekt Lehrsequenz Einsatz virtuell Spiel,0
1_PHZH_2014_MS1_0c2a187e_4ba99837_introduction.txt,folgend Frage dafür erkenntnisleitend • gehen unterschiedlich Protagonist Spielfilm The Namesake verschieden kulturell Kontext Herkunftskultur versus Aufnahmekultur,0
2_PHZH_ca25aeb8_4fcd40fc_04143015_041e8730_ Departement Sekarstufe I_d9ac29f9_c7296853_2fce384c_d3803867_introduction.txt,danach folgen gründlich Auseinandersetzung eben Konzept,0
1_PHZH_607d1004_e01a3e09_a63acd73_7a669003_4fcd40fc_introduction.txt,bereits angesprochen Bedeutung historisch Spielfilm Zusammenhang unterstreichen Schillinger  S.  Aussage besagen Film zunehmend Vorstellung Vergangenheit dominiern,0
1_PHZH_838eb8a3_4fcd40fc_ Departement Sekarstufe I_a665daa3_9a79bf39_introduction.txt,letzter wichtig Teil theoretisch Teil dienen Auseinandersetzung modern Lernverständnis,3g
1_PHZH_0633597c_9777b73e_4fcd40fc_7a669003_fc19e214_introduction.txt,Schlussteil fassen Fazit wesentlich Erkenntnis zusammen beziehen nochmals Beginn gestellt Frage,3g
1_PHZH_2014_MS1_4baa6d00_introduction.txt,Infolgedessen sollen Arbeit Versuch Geschichtsunterricht moralisch Urteilsbildung Lernende Holocaustspielfilmen fördern somit neben Vermittlung historisch wissen Thema Holocaust moralisch Erziehung anzusterben,3a
1_PHZH_2014_MS1_53b4b6ca_introduction.txt,handeln Lehrperson gut Effekt,3b
1_PHZH_01491c28_4fcd40fc_6ab73ff2_c7296853_ Departement Sekarstufe I_introduction.txt,Meinung vieler Politiker Bildungsökonome Bildungsspezialist diverser Artikel veröffentlichen,0
1_PHZH_9bb4c1ff_cb53f07d_9ea67f3f_7a669003_introduction.txt,deshalb Frage nachgehen Schülerin Schüler selbstgesteuert lernen führen heisst  Schülerin Schüler selbstgesteueren lernen,3b
1_PHZH_607d1004_e01a3e09_a63acd73_7a669003_4fcd40fc_introduction.txt, rassistisch Vorwurf zurückweisen,0
1_PHZH_2014_MS1_9685d328_1df949aa_introduction.txt,gehen Schülerin Schüler ungerecht empfunden Strafe,3b
1_PHZH_8a10f9ae_e23bf532_4fcd40fc_57c4b296_6c2cf7e3_7a669003_introduction.txt,zusätzlich fahren schriftlich Befragung ausgewählt Person Forschungsteil ebenfalls Experte innen Masterarbeit fungieren,3d
1_PHZH_416b9c70_4fcd40fc_34e280f1_7a669003_a43bb46c_introduction.txt,anhand Leitfaden zehn Lehrperson halboffen Interview führen,3d
1_PHZH_2014_MS1_4ba99837_0c2a187e_introduction.txt,folgend Kapitel zuerst empirisch Vorgehen erklären danach folgen inhaltlich filmsprachlich Analyse ausgewählt Sequenz jeweilig Protagonist,3g
1_PHZH_2012_MS1_e868b043_introduction.txt,Praxisteil zunächst erklären weshalb Design Unterrichtsforschung sogenannter Aktionsforschung wählen Messinstrumente beschreiben Wirksamkeit musikalisch Unterrichtseinstieg evaluieren,3g
1_PHZH_b90a5633_341f812d_d5da8593_b809dc24_4fcd40fc_abd50988_e01a3e09_a63acd73_7a669003_introduction.txt,Medium Spielfilm Doppelfunktion gerecht finden Theorieteil Auseinandersetzung Zeit Darstellung nämlich aktuell Stand Kleopatraforschung Zeit Quelle nämlich Frauengeschichte statt,3g
1_PHZH_2014_MS1_17ccf0d6_introduction.txt,Arbeit abschliessend folgen Schlussteil Reflexion Zielsetzung Zusammenfassung zentral Ergebnis bestehen,3g
1_PHZH_ac9f8553_4fcd40fc_d59f3d3c_904e75e1_7a669003_introduction.txt,dabei sollen theoretisch Ansatz Forschung Fall vergleichen,3d
1_PHZH_0633597c_9777b73e_4fcd40fc_7a669003_fc19e214_introduction.txt,Anschluss folgen Erörterung Thema Erklär wichtig Rolle Zusammenhang Partnerpuzzle spielen,3g
1_PHZH_574404cd_7a669003_4fcd40fc_0e7dd130_d76c66ea_introduction.txt,Inwiefer Urteil gekoppeln Kenntnis Unterricht vermitteln versuchen,3b
1_PHZH_607d1004_e01a3e09_a63acd73_7a669003_4fcd40fc_introduction.txt,vorangehend Ausführung sprechen Relevanz historisch Spielfilm Geschichtsunterricht,1c
1_PHZH_0633597c_9777b73e_4fcd40fc_7a669003_fc19e214_introduction.txt,geschehen separat Fach gegeben Lektion integrieren entsprechend Lernsetting umsetzen,0
1_PHZH_2014_MS1_0c2a187e_4ba99837_introduction.txt,letzter Unterkapiteln Begriff Kultur eingehen verschieden Kulturkonzept einander genübergestellen schlussendlich erläutern wer interkulturell Kompetenz verstehen,3g
1_PHZH_2014_MS1_55a86fc5_introduction.txt,Mädchen Sekundarschulalter beschränken möchten Grund gering sportlich Aktivität herausfinden,2a
1_PHZH_51b58dcc_7d0941f4_56b082fa_7a669003_introduction.txt,anschliessend Kapitel Ergebnis präsentieren interpretieren,3g
1_PHZH_2014_MS1_81e0174a_introduction.txt,Faszination nie Zusammenhang Science Centern untersuchen,2c
1_PHZH_0e9f5c53_c53a9081_4fcd40fc_87e91429_7a669003_introduction.txt,Erkenntnis Interview ergeben basieren somit individuell Einschätzung interviewt Lehrperson geben subjektiv Einblick arbeitszufriedenheitsempfinden,3d
1_PHZH_2014_MS1_be36150e_39435396_introduction.txt,Interviewte Retrospektive erzählen stehen einzeln Episode grösser Gesamtkontext,0
1_PHZH_180dda13_7a669003_4d668c53_4fcd40fc_introduction.txt,darauf folgen Schlussteil Arbeit Kap .  Ergebnis Diskussion nochmals zusammengefasst anfänglich Fragestellung Verbindung setzen,3g
1_PHZH_2014_MS1_55a86fc5_introduction.txt,Review Gesundheitsstudium Schweiz Jahr   zusammenfassen Lamprecht & Stamm   bestätigen ebenfalls Mann jung Jahr deutlich mehr bewegen jung Frau,1e
1_PHZH_380c4394_904e75e1_9c114cfc_4fcd40fc_7a669003_introduction.txt,Psychologie Pädagogik stellen Bereich Argumentation Kind jugendliche erwachsene Lücke fest,0
1_PHZH_2014_MS1_63819ad4_e673af8f_introduction.txt,möchten untersuchen gut neu Beruf einsteigend Lehrperson ähnlich Ausbildung nossen ebenfalls Wichtigkeit kognitiv Aktivierung hinweisen Ansatz Praxis umsetzen,3a
1_PHZH_2014_MS1_956d232e_introduction.txt,neopiagetisch Ansatz derjenige Kurt Fischer  zitieren Hoy  – zeigen jung Forschungsarbeit  geeignet schulisch Förderung jugendliche ab  Jahr bereits fähig Abstraktion differenziert Beurteilung,1e
1_PHZH_607d1004_e01a3e09_a63acd73_7a669003_4fcd40fc_introduction.txt,handeln bereits zuvor erwähnen direkt Abbildung Gesehenem,0
1_PHZH_607d1004_e01a3e09_a63acd73_7a669003_4fcd40fc_introduction.txt,erster Schritt theoretisch Teil historisch Hintergrund eingehen,3g
1_PHZH_2014_MS1_7db60009_introduction.txt,Interesse Lauf Zeit Veränderung geben wodurch nächster Frage auftauchen Fragestellung  Illustrationspraxis Bezug Bildtype Vergleich alt neu Lehrbücher verändern,3b
1_PHZH_2014_MS1_93f526f5_introduction.txt,untersuchen “ Lebensbedingung schlecht Ausbildung Kompetenz Kind führen,2a
1_PHZH_607d1004_e01a3e09_a63acd73_7a669003_4fcd40fc_introduction.txt,Gabriel Weisskopf Masterarbeit PHZH Mai Seite insgesamt fünf Phase Geschichte Vietnamkriegsfilm früh er-Jahre herauskristallisieren,0
1_PHZH_2014_MS1_f89ebf2e_introduction.txt,vorliegend Arbeit beschäftigen Naturkundeunterricht lesen Sachtext üben lernen,0
1_PHZH_2014_MS1_2b75f2b3_introduction.txt,zeigen Beispiel Ergebnis international Grundschul-Lese-Untersuchung IGLU ): Tatsache zwei Drittel Schülerin Schüler Unterricht erfahren gleich Übungsaufgabe gleich Material arbeiten lässt vermuten individuell Fehlerschwerpunkt abzielend Förderung Rechtschreibeunterricht Selbstverständlichkeit  Bos u. a.,1e
1_PHZH_734976d3_08ec7951_c1c21b94_e4075b87_55241912_4fcd40fc_374bed2b_5ffb855c_22657153_790ce245_7a669003_introduction.txt,spät wandern Mensch Spanien,0
1_PHZH_607d1004_e01a3e09_a63acd73_7a669003_4fcd40fc_introduction.txt,zweiter Studie Bedeutung Thematik Rassismus gegenüber afro-amerikanisch Bevölkerung USA ansprechen,0
1_PHZH_2014_MS1_2b75f2b3_introduction.txt,Videoaufnahme Hilfe erstellt Erhebungsinstrument überfachlich Kompetenz Lehrplan codieren auswerten,3d
1_PHZH_607d1004_e01a3e09_a63acd73_7a669003_4fcd40fc_introduction.txt,Arbeit untersucht Vietnamkriegsfilm handeln historisch Spielfilm,3e
1_PHZH_2014_MS1_6c80d44e_introduction.txt,Verengung Interessengebiet führen schliesslich zentral Fragestellung Arbeit,3b
1_PHZH_b31c481e_81d3dc3c_373d4bbd_b88f304f_33b54baf_9b74fbe3_02062de0_90840986_025d0dab_introduction.txt,anhand Codesystem Anpassung ursprünglich Kategoriensystem Pilotstudie entstehen drei verschieden Lehrmittel Inhalt überprüfen,3d
1_PHZH_8a10f9ae_e23bf532_4fcd40fc_57c4b296_6c2cf7e3_7a669003_introduction.txt,Forschungsteil erläutern methodisch vorgehen präsentieren darauffolgend Ergebnis anhand Datenauswertung eruieren,3g
1_PHZH_8881d2aa_ Departement Sekarstufe I_3ee137a2_e01a3e09_introduction.txt,insbesondere Studie nordamerikanisch Raum hinausgehen kulturvergleichend vorgehen bestehen gross Bedarf. Film Medium Potential verschieden Sichtweise aufzuzeigen gegnerisch Perspektive zugänglich Rezeptionsstudien Thema Nahost-Konflikt Spielfilm besonders interessant,2c
1_PHZH_574404cd_7a669003_4fcd40fc_0e7dd130_d76c66ea_introduction.txt,daraus resultierend ergeben Frage inwiefern Erwerb Wissen Einfluss Einstellung Lernende,3b
1_PHZH_87e91429_c53a9081_4fcd40fc_7a669003_e696c4b9_introduction.txt,beschäftigen jugendliche heute,0
1_PHZH_8881d2aa_ Departement Sekarstufe I_3ee137a2_e01a3e09_introduction.txt,Filmanalyse sollen einerseits Aufschluss darüber geben Konfliktpartei allgemein darstellen sowie andererseits Konfliktfeld aufzeigen respektive weglassen komplex Konflikt folglich darstellen,3a
1_PHZH_b90a5633_341f812d_d5da8593_b809dc24_4fcd40fc_abd50988_e01a3e09_a63acd73_7a669003_introduction.txt,Analyseprozess Werner Faulstich Grundkurs Filmanalyse  Helmut Korte Einführung systematisch Filmanalyse  skizziert analysemethoden leiten,3d
1_PHZH_2011_MS1_f89749b3_introduction.txt,Weiter folgen Auseinandersetzung Fokusgruppengesprächen zwei Zykl einteilen,3g
1_PHZH_8a10f9ae_e23bf532_4fcd40fc_57c4b296_6c2cf7e3_7a669003_introduction.txt,danach diskutieren Untersuchungsresultate kritisch bringen Verbindung Theorie ungeklärt Inhalt aufmerksam,3g
1_PHZH_c401df5e_c53a9081_4fcd40fc_87e91429_7a669003_6879a159_introduction.txt,Masterarbeit Titel Freude Lehrberuf stärken erhalten besitzen folgend Aufbau zunächst theoretisch Hintergrund aufarbeiten darstellen,3g
1_PHZH_2014_MS1_1f00be7e_aa2ab8ba_introduction.txt,Mittel eigens ausgearbeitet Kodierund Bewertungsraster Ergebnis raten,3d
1_PHZH_2014_MS1_ab8aad8c_introduction.txt,Erfüllung anspruchsvoller Ziel wiederum positiv Effekt Selbstkonzept Fuchs  S.,0
1_PHZH_2014_MS1_7db60009_introduction.txt,daraus ergeben erster Fragestellung Fragestellung  oft Bildtype verschieden Natur-und-TechnikLehrbüchern vertreten,3b
1_PHZH_ac9f8553_4fcd40fc_d59f3d3c_904e75e1_7a669003_introduction.txt,anschliessend zeigen literarisch Werk kommen Arbeit verwenden,3g
1_PHZH_2014_MS1_81e0174a_introduction.txt,Datum Tabelle Exponat Merkmal besitzen lassen Merkmal herausfinden derjenige Exponate Schülerin Schüler meister faszinieren,3d
1_PHZH_2014_MS1_8d8dd7fa_introduction.txt,Ziel vorliegend Arbeit Prozess Denkanstöss praxisbezogen Vorschlag fördern entsprechend Diskussion anzuregen,3a
1_PHZH_2011_MS1_2352efa7_introduction.txt,stecken mehr selber weiss,0
1_PHZH_2014_MS1_2b75f2b3_introduction.txt,qualitativ Fallstudie drei Gruppe Arbeit videografisch dokumentieren,3d
1_PHZH_af46a886_3beda123_b58d1e70_09717d62_c70fa686_dfcfd993_4fcd40fc_3567c78e_c713876f_0034d060_introduction.txt,Vorwissen eruieren Vorwissenserhebung Schülerin Schüler . Sekundarstufe durchführen,3d
1_PHZH_8881d2aa_ Departement Sekarstufe I_3ee137a2_e01a3e09_introduction.txt,Weltanschauung Geschichtsdeutung spielen dabei entscheidend Rolle weshalb Umsetzung Konflikt Medienwelt besonders brisant,1c
1_PHZH_7a669003_b5e98c9a_c7296853_21428f03_introduction.txt,allein zeigen schon hoch Relevanz Thematik grundsätzlich Auseinandersetzung lohnen,1c
1_PHZH_ba40faf0_668b7cec_7a669003_4fcd40fc_introduction.txt,Schlussteil beinhalten Fazit Konsequenz eigen Unterricht ableiten zusammengefasst darstellen,3g
1_PHZH_4fcd40fc_e01a3e09_a43b8048_7a669003_8450ab59_introduction.txt,Ausdruck wahr Begebenheit  Spielfilm geben :-Abbild Wirklichkeit fallen Publikum hingegen häufig schwer,0
1_PHZH_2014_MS1_0c2a187e_4ba99837_introduction.txt,• Standard  Schule Gesellschaft Lehrperson weiss Gesamtsystem Schule Dynamik unterschiedlich Realität Anspruch stehen,0
1_PHZH_0633597c_9777b73e_4fcd40fc_7a669003_fc19e214_introduction.txt,nächster Kapitel gehen kooperativ lernen erläutern Vorteil Risiko,3g
1_PHZH_607d1004_e01a3e09_a63acd73_7a669003_4fcd40fc_introduction.txt,historisch Spielfilm gewiß Bild Geschichte historisch Ereignis liefern,0
1_PHZH_b90a5633_341f812d_d5da8593_b809dc24_4fcd40fc_abd50988_e01a3e09_a63acd73_7a669003_introduction.txt,Resultat Filmanalyse Kapitel Analyse nachlesen,3g
1_PHZH_607d1004_e01a3e09_a63acd73_7a669003_4fcd40fc_introduction.txt,selten vorkommend Darstellung Vietnamese Rede,0
1_PHZH_2014_MS1_93f526f5_introduction.txt,abschliessend Schlussfolgerunge Kapitel  zentral Ergebnis Erkenntnis darlegen Grenze Arbeit aufzeigen Ausblick skizzieren pädagogisch Konsequenz daraus ableiten,3g
1_PHZH_2bb5e5c8_bc3c1032_e01a3e09_4fcd40fc_27c6f769_introduction.txt,Arbeit bestehen drei Teil Theorie Forschung Schlussteil,3g
1_PHZH_2014_MS1_2b75f2b3_introduction.txt,theoretisch Teil erster Themengebiet integrativ Schule aufgreifen,3g
1_PHZH_855c392b_904e75e1_d59f3d3c_4fcd40fc_7a669003_introduction.txt,untersucht Akteur entstehen dabei Möglichkeit Reflexion Rollenhandeln beteiligt Akteur anstossen sowie untersucht Team Anpassung handeln ermöglichen,0
2_PHZH_e01a3e09_5532d6a2_d7c2cc9e_a63acd73_1e8ec8a0_4fcd40fc_adebc6e6_introduction.txt,erster Schritt derjenige Passage Äusserunge DDR hervorheben zweiter Sodann kritisch untersuchen,0
1_PHZH_2014_MS1_ab063590_introduction.txt,jugendliche sozial schwach Milieu wachsen Studie zufolge bildungsfern somit schulisch benachteiligt jugendliche sozial stark Umfeld,0
1_PHZH_2014_MS1_7db60009_introduction.txt,Gesellschaft Bild allgegenwertig Alltag mehr wegzudenken,1c
1_PHZH_2014_MS1_27f62dff_introduction.txt,Erster theoretisch Hintergrund Arbeit erläutern,3g
1_PHZH_2014_MS1_b11a5d4b_040b4719_introduction.txt,Grenze Eingriff Förderung,3b
1_PHZH_2014_MS1_84175e88_introduction.txt,daher stehen folgend Fragestellung Zentrum Masterarbeit jugendliche Sekundarstufe I Emotionale Intelligenz fördern,3b
1_PHZH_8a10f9ae_e23bf532_4fcd40fc_57c4b296_6c2cf7e3_7a669003_introduction.txt,Transkript werten anschliessend Mithilfe zusammenfassend Inhaltsanalyse,3d
1_PHZH_9ea67f3f_4fcd40fc_3de4c84d_c4f67cb5_7a669003_introduction.txt,wichtig Punkt beide Aktionszykle nachfolgend Kapitel gesondert diskutieren,3g
1_PHZH_2014_MS1_8d8dd7fa_introduction.txt,Umstand führen Gegenstand allgemein Bildung betrachten Stuber,0
1_PHZH_2014_MS1_ab063590_introduction.txt,ungleich Verteilung Lernvoraussetzung sozial Milieu führen hoch Chancenungleichheit bezüglich Schulerfolg,0
1_PHZH_b63cee49_764f4fe1_1e8ec8a0_d4c16655_introduction.txt,Studie nachweisen Teilnehmerinn Teilnehmer Schreibkompetenz verbessern Elley & Mangubhai  Janopoulos  Hafiz & Tudor  Hafiz & Tudor  Mason & Krashen,1e
1_PHZH_2014_MS1_7db60009_introduction.txt,Standard  Planung Durchführung Unterricht Lehrperson unterrichten Grundlage Fachund berufswissenschaftlich Kenntnis Lehrplan Leitidee Lehrmittel Schulprogramme sowie darauf beruhend Planung,0
1_PHZH_2014_MS1_53b4b6ca_introduction.txt,Untersuchung Synthese mehr Metaanalyse ' Studie ca.,0
2_PHZH_ca25aeb8_4fcd40fc_04143015_041e8730_ Departement Sekarstufe I_d9ac29f9_c7296853_2fce384c_d3803867_introduction.txt,jung Forschung v.a. Ralf Schwarzer Matthias Jerusalem Begriff Terminus Selbstwirksamkeit zusammengefasst,0
1_PHZH_4fcd40fc_2ddc90ae_7a669003_c72b17ed_introduction.txt,Methode Aktionsforschung bilden Kernkomponente Arbeit,3d
1_PHZH_c53a9081_057a2bfb_4fcd40fc_87e91429_7a669003_introduction.txt,je bewusst einzeln Kommunikationsaspekt desto gezielt gelingen Rückmeldung,0
1_PHZH_2014_MS1_17ccf0d6_introduction.txt,dritter Teil Ergebnis bestehen Analyse drei Einzelfall Datenmaterial Arbeit dienen,3g
1_PHZH_575b52ea_4fcd40fc_a72390b6_ Departement Sekarstufe I_introduction.txt,vorliegend Arbeit Standard   d pädagogisch Hochschule Zürich beziehen befassen Thematik gehen nah Beispiel Schulentwicklung,2a
1_PHZH_2014_MS1_2b75f2b3_introduction.txt,Arbeit theoretisch empirisch Teil gliedern,3g
1_PHZH_2011_MS1_a1ee7fc8_introduction.txt,Handlungsmassnahmen zwei Ebene Schule Eltern  Schule jugendliche Konsequenz Berufswahlunterricht folgern,0
1_PHZH_9ea67f3f_4fcd40fc_3de4c84d_c4f67cb5_7a669003_introduction.txt,Schlussteil setzen Ergebnis Bezug Fragestellung Gedanke Grenze lesefördernd Massnahm  zeigen Rahmen Arbeit weiterführen,3g
1_PHZH_2014_MS1_b11a5d4b_040b4719_introduction.txt, Ruth Cohn  Ruth Cohn  greifen Zitat möglich Ursprung heutig Schulreformen,0
1_PHZH_607d1004_e01a3e09_a63acd73_7a669003_4fcd40fc_introduction.txt,drei verschieden historisch Spielfilm Handlung Vietnamkrieg situieren Geschichtsbilder analysieren deuten,3e
1_PHZH_4fcd40fc_e01a3e09_7a669003_f04d0429_9d7a2722_introduction.txt,Kapitel Entwicklungsphase Schweizer Geschichtsschreibung präsentieren wodurch national Geschichtsbilder präzisieren,3g
1_PHZH_2014_MS1_cfcc774c_introduction.txt,Fokus vorliegend Arbeit liegen jedoch bereits andeuten woanders,2a
1_PHZH_2014_MS1_74c9a371_introduction.txt,Masterarbeit bestehen zwei Zykl,3g
1_PHZH_0633597c_9777b73e_4fcd40fc_7a669003_fc19e214_introduction.txt,Anschluss erläuteren erster Aktionszyklus Untersuchung,3g
1_PHZH_180dda13_7a669003_4d668c53_4fcd40fc_introduction.txt,schätzen Akteur Chance gegenwärtig Volksschulsystem Bezug frei Schulwahl,3b
1_PHZH_276a5fc3_ed537019_4fcd40fc_dc411c57_a999b01e_ Departement Sekarstufe I_introduction.txt,Kapitel befassen Unterrichtsbesuchen Datenerhebung,3g
1_PHZH_4fcd40fc_09a8ec4a_ Departement Sekarstufe I_a6ac235e_d435f07a_introduction.txt,Studie verschieden Kompetenz beide Sprache mitund untereinander vergleichen,0
1_PHZH_9bb4c1ff_cb53f07d_9ea67f3f_7a669003_introduction.txt,Arbeit gliedern zwei Hauptteil theoretisch Teil empirisch Teil,3g
1_PHZH_2014_MS1_1f00be7e_aa2ab8ba_introduction.txt,Schülerin Schüler Kindheit oft Lego spielen gut Voraussetzung Konstruktionsproblem lösen,3b
1_PHZH_0e9f5c53_c53a9081_4fcd40fc_87e91429_7a669003_introduction.txt,empirisch Teil Methode informieren Datum vorliegend Untersuchung erheben,3g
1_PHZH_2014_MS1_7dc244ae_introduction.txt,dennoch integriert Schülerin Schüler besonderer pädagogisch Bedürfnisse gegenüber negativ Einstellung Sonderklasse Moser Opiz,0
