text_id,sentence,label
1_PHZH_2014_MS1_5b80a1aa_0b4089f0_introduction.txt,Computerspiel generieren kürzester Zeit Milliarde Dollar Umsatz Million Mensch weltweit Stunde verbringen Parallelwelt leben  Motiv Mensch bringen Computerspiele nutzen verschieden Studie untersuchen Olse,0
1_PHZH_2014_MS1_55a86fc5_introduction.txt,drei Stichprobe ‘   ‘  ‘  Person telefonisch computergestützt Interview schriftlich Fragebög befragen,0
1_PHZH_607d1004_e01a3e09_a63acd73_7a669003_4fcd40fc_introduction.txt,Terminus Geschichtskultur umfassen dabei breit Spektrum verschieden Bereich Hinblick gemeinsam Umgang Vergangenheit miteinander Verbindung bringen,1d
1_PHZH_2f466bfd_4fcd40fc_42ed659e_7a669003_2ca5a840_a729a264_introduction.txt,Erläuterung Zuordnung sowie Erkenntnis befinden Schlussteil Arbeit,3g
1_PHZH_838eb8a3_4fcd40fc_ Departement Sekarstufe I_a665daa3_9a79bf39_introduction.txt,Hintergrund Arbeit transparent erster Theoriekapitel Kapitel  Thema PISA genau betrachten,3g
1_PHZH_607d1004_e01a3e09_a63acd73_7a669003_4fcd40fc_introduction.txt,obwohl geografisch weit entfernt Schweiz deutschsprachig Raum vieler Spielfilm Hollywood deutschsprechend Zielpublikum synchronisieren,0
1_PHZH_8881d2aa_ Departement Sekarstufe I_3ee137a2_e01a3e09_introduction.txt,insbesondere Rezeptionsstudien bestehen hoch Bedarf,2c
1_PHZH_2014_MS1_7db60009_introduction.txt,umso erstaunlich bisher verhältnismässig klein Anzahl Forschung geben Bild Einfluss auseinandergesetzen,2c
1_PHZH_3f0e91e4_4a97c710_dd8574ec_124b0b6b_4fcd40fc_7a669003_introduction.txt,Professionell stehen konkret Regel Methode Verfügung Bewältigung schwierig Situation pädagogisch Handlungsfeld zweifellos verlassen,0
1_PHZH_2014_MS1_9685d328_1df949aa_introduction.txt,dritter Teil folgen Kapitel IV Beschreibung verwendet Forschungsmethode konkret Vorgehen Datenerhebung,3g
1_PHZH_2012_MS1_e868b043_introduction.txt,sprechen darauf,3b
1_PHZH_2014_MS1_84175e88_introduction.txt,emotional Intelligenz folgend Definition finden Wörterbuch Psychologie Werner D. Fröhlich  ): emotional Intelligenz emotional intelligence,0
1_PHZH_2014_MS1_74c9a371_introduction.txt,Fragestellung gestalten jedoch schwierig Lauf Prozeß mehrmals vereinfachen,0
1_PHZH_8881d2aa_ Departement Sekarstufe I_3ee137a2_e01a3e09_introduction.txt,insbesondere letzter Argument Robert Burgoyne anregen vorliegend Arbeit drei Spielfilm Nahost-Konflikt analysieren,0
1_PHZH_2014_MS1_81e0174a_introduction.txt,erster Seite abgeklärt Exponat Schülerin Schüler meister Fasziniert geschehen verschieden Frage Faszination umschreiben,3d
1_PHZH_b31c481e_81d3dc3c_373d4bbd_b88f304f_33b54baf_9b74fbe3_02062de0_90840986_025d0dab_introduction.txt,Untersuchungsgegenstand drei Lehrmittel,3e
1_PHZH_2014_MS1_7dc244ae_introduction.txt,dabei stehen Unterrichtssetting Lehrperson sowie verhalten Umgang integriert Schülerin Schüler Zentrum Interesse,2a
1_PHZH_2014_MS1_0c2a187e_4ba99837_introduction.txt,Heterogenität begegnen Tag Ausgangslage Masterarbeit definieren,0
1_PHZH_2014_MS1_8a45a584_introduction.txt,Anschluss folgen Beschreibung Forschungsmethode,3g
1_PHZH_2014_MS1_2bbf72a7_introduction.txt, c Schweizer Sportlandschaft überhaupt Kapazität weit Sportangebot Sekundarstufe decken bestehend Programm Mehrwert interschulisch Wettkämpfe bereits ab,3b
1_PHZH_2014_MS1_27f62dff_introduction.txt,Kontext Arbeit Fokus jugendliche ästhetisch Praktik legen,2a
2_PHZH_ca25aeb8_4fcd40fc_04143015_041e8730_ Departement Sekarstufe I_d9ac29f9_c7296853_2fce384c_d3803867_introduction.txt,bislang Forschung jugendliche Selbstwirksamkeit allerdings jugendliche Volksschule ausschließen,0
1_PHZH_2014_MS1_0c2a187e_4ba99837_introduction.txt,ausschlaggebend zweiter Fragestellung Kapitel . Filmsprache relevant filmsprachlich Mittel erörtern,3g
1_PHZH_2014_MS1_f89ebf2e_introduction.txt,Reflexion Durchführung bilden Kapitel .. Schluss praktisch Teil,3g
1_PHZH_2014_MS1_93f526f5_introduction.txt,anschliessend primär sekundär Herkunftseffekt sowie Konzept Bourdieu möglich Erklärungsansatz sozial Ungleichheit Bildungssystem darlegen Kapitel .,3g
1_PHZH_2014_MS1_63819ad4_e673af8f_introduction.txt,gross Ziel Auseinandersetzung Element erfolgreich Lehren folglich Lernen weit empirisch Schritt Forschung tätigen,3a
1_PHZH_2014_MS1_6c80d44e_introduction.txt,Näherer drei Fall auswerten schliesslich Kontext theoretisch Rahmen diskutieren,3g
1_PHZH_59a90fd8_4fcd40fc_5327f408_ Departement Sekarstufe I_437a0090_introduction.txt,legen Arbeit Fokus Fertigkeitstrainer neu Mathematiklehrmittel,2a
1_PHZH_9a6754e1_7b92d97d_05fcf6c3_7c3e5fa5_7102dcb4_2ce3aa35_9777b73e_d39e2bb2_60d03c4b_introduction.txt, Lohnt organisatorisch Aufwand handlungsorientiert Unterrichtseinheit Lernerfahrung ermöglichen nachhaltig Lernerfolg Bereich überfachlich Kompetenz erzielen,3b
1_PHZH_ac9f8553_4fcd40fc_d59f3d3c_904e75e1_7a669003_introduction.txt,Ziel Arbeit einerseits Innenperspektive Mobbingopfer liefern andererseits Lehrperson gut verstehen tun eigen Schulzimmer Mobbing unbemerkt Statte gehen,3a
1_PHZH_c53a9081_057a2bfb_4fcd40fc_87e91429_7a669003_introduction.txt,Standard  Kommunikation Lehrperson kommunizieren Berufsfeld verständlich effizient entwicklungsförderlich Lernende Klasse Gruppe Kollegium Team Fachperson Eltern Behörde Öffentlichkeit,0
1_PHZH_2014_MS1_93f526f5_introduction.txt,Wahrnehmung Entscheidung  subjektiv Lehrperson fällen rufen Wunsch Transparenz hervor,0
1_PHZH_4fcd40fc_09a8ec4a_ Departement Sekarstufe I_a6ac235e_d435f07a_introduction.txt,sprechen lesen anhand formell Unterricht lehren erlernen üben,0
1_PHZH_4fcd40fc_09a8ec4a_ Departement Sekarstufe I_a6ac235e_d435f07a_introduction.txt,nächster Kapitel vollständig Verständnis aktuell Situation Englischunterricht Kanton Zürich Rahmenbedingung neu Strukturierung Organisation Fach vorstellen,3g
1_PHZH_4fcd40fc_e01a3e09_a43b8048_7a669003_8450ab59_introduction.txt,darüber hinaus Person Kolumbus weltweit bekannt historisch Figur Entdecker-Tat umjubeln allerdings Schule selten brutal Umgang indigen Bevölkerung kritisieren,0
1_PHZH_87e91429_c53a9081_4fcd40fc_7a669003_e23e6810_introduction.txt,dabei stehen drei Aspekt Arbeit Fokus,2a
1_PHZH_2011_MS1_2352efa7_introduction.txt,gut Letzt sowohl pädagogisch Konsequenz Schulalltag neu Fragestellung Sinn Ausblick dargelegen,3g
1_PHZH_9bb4c1ff_cb53f07d_9ea67f3f_7a669003_introduction.txt,danach siebter Kapitel Diskussion Ergebnis darlegen wobei Ergebnis zwei Aktionszykle miteinander vergleichen theoretisch Grundlage Verbindung bringen,3g
1_PHZH_607d1004_e01a3e09_a63acd73_7a669003_4fcd40fc_introduction.txt,US-Soldat somit Hauptthema Arbeit gesamt Entwicklung Verlaufe Film untersuchen,2a
1_PHZH_2011_MS1_2352efa7_introduction.txt,Schlussteil nochmals Ausgangslage Zielsetzung verweisen zentral Ergebnis weit Mal zusammenfassend darstellen,3g
1_PHZH_51b58dcc_7d0941f4_56b082fa_7a669003_introduction.txt,Theorieteil Fehlerkultur zwei Kapitel aufteilen Kapitel dienen Eingrenzung Begriff Fehler Fehlerkultur,3g
1_PHZH_2014_MS1_53b4b6ca_introduction.txt,weiss Schülerin Schüler Fachwissen Fachkönne aneignen Lernsituation schaffen Kompetenz fördern,0
1_PHZH_2011_MS1_2352efa7_introduction.txt,theoretisch Teil folgen Erläuterung Forschungsmethode Aktionsforschung,3g
1_PHZH_4fcd40fc_09a8ec4a_ Departement Sekarstufe I_a6ac235e_d435f07a_introduction.txt,entlang Thematike theoretisch Teil Arbeit zwei Säule bestehen entwicklungspsychologisch Säule erziehungswissenschaftlich Säule,3g
1_PHZH_51b58dcc_7d0941f4_56b082fa_7a669003_introduction.txt,empirisch Teil Arbeit Forschungsfrage hergeleiten methodisch vorgehen beschreiben Forschungssetting erläutern Auswertung Interpretation Datum vorstellen,3g
1_PHZH_2014_MS1_7db60009_introduction.txt,Arbeit ganz klar Anzahl verschieden Kategorie Vordergrund stehen bieten quantitativ Bildanalyse Hilfe folgend Kapitel hergeleitet Fragestellung beantworten sollen,3d
1_PHZH_2014_MS1_1f00be7e_aa2ab8ba_introduction.txt,. Aufbau Arbeit,0
1_PHZH_2f466bfd_4fcd40fc_42ed659e_7a669003_2ca5a840_a729a264_introduction.txt,ebenfalls Kapitel befinden Begründung Auswahl Stichprobe,3g
1_PHZH_3f0e91e4_4a97c710_dd8574ec_124b0b6b_4fcd40fc_7a669003_introduction.txt,dritter Teil Arbeit Ergebnis Untersuchung nochmals zusammenfassend darstellen,3g
1_PHZH_4fcd40fc_09a8ec4a_ Departement Sekarstufe I_a6ac235e_d435f07a_introduction.txt,• extensiv Lese Englischunterricht praktizieren,3b
2_PHZH_e01a3e09_5532d6a2_d7c2cc9e_a63acd73_1e8ec8a0_4fcd40fc_adebc6e6_introduction.txt,bedeuten Inhalt aufnehmen weit Gedanke Vermischung fiktional real Element Buch,0
1_PHZH_607d1004_e01a3e09_a63acd73_7a669003_4fcd40fc_introduction.txt,gross Bedeutung Schülerin Schüler Schule Kompetenz vermitteln befähigen Bild bewusst umgehen,1c
1_PHZH_ad8c7b24_d9f2f379_7a669003_4fcd40fc_introduction.txt,Film CD Internet heutig Gesellschaft ganz Kontext Schule Bedeutung gewinnen,1c
1_PHZH_6b465eca_30c6c83d_2bb5e5c8_introduction.txt,aufgrund vorgehen Arbeit folgendermassen gliedern zweiter Kapitel Verhältnis Schule Familie Basis bestehend theoretisch Konzept analysieren,3g
1_PHZH_ad8c7b24_d9f2f379_7a669003_4fcd40fc_introduction.txt,Inwiefer Einbezug jugendliche Bestandesplanung Motivation Nutzung Angebot Schulbibliothek steigern,0
1_PHZH_607d1004_e01a3e09_a63acd73_7a669003_4fcd40fc_introduction.txt,Art Weise übernehmen Zeugenfunktion Badsey  S.,0
1_PHZH_ac9f8553_4fcd40fc_d59f3d3c_904e75e1_7a669003_introduction.txt,Rest Phänomen Arbeit Perspektive Opfer beleuchten entstehen rein subjektiv Ansicht Mobbingfall,0
1_PHZH_2014_MS1_55a2d87e_introduction.txt,gelten daher klären Begriff Geschlecht  gend verstehen Rolle dabei Geschlechterstereotype spielen Kapitel .,3g
1_PHZH_2014_MS1_27f62dff_introduction.txt,letzter Teil Verknüpfung zukünftig Tätigkeit Werken-Textil-Lehrperson,3g
1_PHZH_2014_MS1_f4fb4cbc_introduction.txt,Arbeit umfassen zwei Hauptteil theoretisch empirischen sowie Einleitung Schlussteil,3g
1_PHZH_2014_MS1_7db60009_introduction.txt,überhaupt möglich bräucht Lehrperson adäquat Wissen Lernwirksamkeit Bild Text,0
1_PHZH_2014_MS1_397b021f_introduction.txt,. Einleitung,0
1_PHZH_607d1004_e01a3e09_a63acd73_7a669003_4fcd40fc_introduction.txt,Studie vietnamesisch Vietnamkriegsfilm beschäftigen sagen meister beachtet US-amerikanisch Vietnamkriegsfilm ausgeglichen Freund-Feind-Bild vermitteln,1e
1_PHZH_2014_MS1_7db60009_introduction.txt,daher Sinn Gebiet lang verweilen,0
1_PHZH_2014_MS1_4571ea34_introduction.txt,ebenfalls qualitativ leitfadengestützt Interview jeweilig Schulleitung Fachlehrpersone durchführen,3d
1_PHZH_2014_MS1_74c9a371_introduction.txt,zuerst Herbst ganz Klasse unvorbereitet Vorstellungsinterviews führen filmen,3d
1_PHZH_607d1004_e01a3e09_a63acd73_7a669003_4fcd40fc_introduction.txt,Rahmen Masterarbeit vermittelt Geschichtsbilder Vietnamkriegsfilm Hollywood eingehen,0
1_PHZH_607d1004_e01a3e09_a63acd73_7a669003_4fcd40fc_introduction.txt,Ziel Arbeit herausfinden Analyse Quellenmaterial d.h. drei historisch Spielfilm Entwicklung Trend Hinblick zuvor behandelt Fragestellung konstatieren lässen,3a
1_PHZH_380c4394_904e75e1_9c114cfc_4fcd40fc_7a669003_introduction.txt,jugendliche betreffen erweisen Kind Alter zehn vierzehn Jahr Mühe  Argument Text identifizieren  Klein et al.  zitieren Astleitner  S.,1e
2_PHZH_fb178718_98736795_8af323c6_4fcd40fc_ Departement Sekarstufe I_02f55750_introduction.txt,Begriff Kompetenz umfassen dabei wissen Fertigkeit Einstellung,0
1_PHZH_180dda13_7a669003_4d668c53_4fcd40fc_introduction.txt,vierter letzter Teil Ergebnis Hintergrund Theorie diskutieren interpretieren Kap .,3g
1_PHZH_607d1004_e01a3e09_a63acd73_7a669003_4fcd40fc_introduction.txt,solch Frage Rahmen Masterarbeit nachgehen,0
1_PHZH_3f0e91e4_4a97c710_dd8574ec_124b0b6b_4fcd40fc_7a669003_introduction.txt,bitten jugendliche unterlassen stattdessen geraten immer mehr jugendliche angeregt Debatte wer Klasse schlechte Lesen,0
1_PHZH_8881d2aa_ Departement Sekarstufe I_3ee137a2_e01a3e09_introduction.txt,beispielsweise Motiv Lesart Beweggrund Produzierende Reichweite unterschiedlich Medienprodukt Veränderung Lesart Präsentationsform Übergang Kulturraum Zusammenhang Filmprodukt Publikum unerforscht Gebiet,2c
1_PHZH_6b465eca_30c6c83d_2bb5e5c8_introduction.txt,vierter Kapitel erfolgen Textin Terpretation,3g
1_PHZH_2014_MS1_0ccb5f81_introduction.txt,Zusammenfassung Kriterienkatalog aufstellen Faktor bestehen sowohl Merkmal gut Unterricht fundamental Bestandteil Videospiele gelten,3d
1_PHZH_2014_MS1_6c80d44e_introduction.txt,Untersuchung folgend Arbeit möchten plakativ ausdrücken klar Themenbereich Bewältigungsauseinandersetzung prophylaktisch Gesundheits-Text meist Burnout-Theme behandeln abgrenzen,0
1_PHZH_2bb5e5c8_bc3c1032_e01a3e09_4fcd40fc_27c6f769_introduction.txt,trotzdem geben vieler Lehrperson bewussen Einsatz didaktisch sinnvoll Schülerin Schüler Filmeinsatz möglichst profitieren,0
1_PHZH_ac9f8553_4fcd40fc_d59f3d3c_904e75e1_7a669003_introduction.txt,mehr stehen jeweils Frage Raum Lehrperson richtig reagieren Fall Mobbing,0
1_PHZH_ad8c7b24_d9f2f379_7a669003_4fcd40fc_introduction.txt,abschliessend Teil Fazit ziehen Empfehlung ableiten Ausblick halten,3g
1_PHZH_2014_MS1_be36150e_39435396_introduction.txt,zweiter Forschungsfrage verschieden weise beantworten versuchen,3b
1_PHZH_9a6754e1_7b92d97d_05fcf6c3_7c3e5fa5_7102dcb4_2ce3aa35_9777b73e_d39e2bb2_60d03c4b_introduction.txt,sollen Lernende Neugierd befriedigen neu Interesse wecken Weiterlern motivieren,0
1_PHZH_c53a9081_057a2bfb_4fcd40fc_87e91429_7a669003_introduction.txt,demonstrieren erneut Relevanz Problematik,1c
1_PHZH_9bb4c1ff_cb53f07d_9ea67f3f_7a669003_introduction.txt,erster Bereich Arbeit zweiter dritter Kapitel Merkmal Aktionsforschung erklären,3g
1_PHZH_a7d0aefe_bd58d445_e4c35051_11f517f1_introduction.txt,zuerst Abhängigkeitsverhältnis DDR Sowjetunion eingehen,3g
1_PHZH_0e7beff5_f226f278_4fcd40fc_ Departement Sekarstufe I_c7296853_introduction.txt,Schritt - Durchführung Analyse Analyse selber anhand Stichwörter Rassismustheorien Katalog indexieren durchführen,0
1_PHZH_2014_MS1_9685d328_1df949aa_introduction.txt,Ziel dabei Deutungsmuster erkennen herausfinden wann Strafe Schülerin Schüler ungerecht wahrnehmen Fall verhalten,3a
1_PHZH_2014_MS1_040b4719_b11a5d4b_introduction.txt,Grenze Eingriff Förderung,3b
1_PHZH_2014_MS1_17ccf0d6_introduction.txt,darauf folgen empirisch Teil,3g
1_PHZH_4fcd40fc_e01a3e09_a43b8048_7a669003_8450ab59_introduction.txt,Filmbotschaft erkennen kritisch Frage stellen Ziel Untersuchungsdesigns,0
1_PHZH_4fcd40fc_e01a3e09_a43b8048_7a669003_8450ab59_introduction.txt,vorliegend Arbeit fokussieren historisch Spielfilm,2a
1_PHZH_b63cee49_764f4fe1_1e8ec8a0_d4c16655_introduction.txt,Masterarbeit sollen untersuchen Lesekompetenz Förderung geeignet Strategie ausbauen,3a
1_PHZH_2014_MS1_8a45a584_introduction.txt,Ende theoretisch Kapitel interkulturell Pädagogik allgemeinen interkulturell Umweltbildung Spezielle eingehen,3g
1_PHZH_2014_MS1_956d232e_introduction.txt,Abschnitt zeigen Schritt Auswertung anstellen Einzelfall beinahe Ergebnis wirken,3g
1_PHZH_2014_MS1_8d8dd7fa_introduction.txt,wenig negativ anhören groß Vorteil,0
1_PHZH_b63cee49_764f4fe1_1e8ec8a0_d4c16655_introduction.txt,Unterrichtsdesign verschieden Forschungsund Auswertungsmethod Kapitel erläutern,3g
1_PHZH_0e9f5c53_c53a9081_4fcd40fc_87e91429_7a669003_introduction.txt,danach Darstellung Ergebnis Diskussion Befund Interview präsentieren Theorie verknüpfen Schlussfolgerunge implizieren,3g
1_PHZH_0e9f5c53_c53a9081_4fcd40fc_87e91429_7a669003_introduction.txt,Masterarbeit sollen genau Punkt ansetzen negativ Berichterstattung Trotz sollen erforschen Lehrperson Beruf gehen,3a
1_PHZH_b63cee49_764f4fe1_1e8ec8a0_d4c16655_introduction.txt,Kapitel Ergebnis Untersuchung entlang Fragestellung vorstellen Kapitel Hintergrund präsentiert theoretisch Aspekt diskutieren,3g
1_PHZH_2014_MS1_7db60009_introduction.txt,Methodischen Teil Kapitel  vier Lehrbücher vorstellen Chemie   Physik   Blickpunkt Chemie   komplett überarbeiten Urknall   Lesenden Lehrbücher Hand,3g
1_PHZH_2014_MS1_956d232e_introduction.txt,Wichtigkeit Schülerinnenund Schülermeinung schulisch Unterricht Rohlf   deutlich Arbeit Bildungseinstellung bewussen Beachtung Lernendenperspektive einstehen,1e
1_PHZH_2014_MS1_17ccf0d6_introduction.txt,Begonnen literaturbasiert theoretisch Teil,3g
1_PHZH_ad8c7b24_d9f2f379_7a669003_4fcd40fc_introduction.txt,Schluss Fazit Theorieteil ziehen,3g
1_PHZH_87e91429_c53a9081_4fcd40fc_7a669003_e696c4b9_introduction.txt,anschliessend Havighurst Konzept Entwicklungsaufgab vorstellen worauf Weiterentwicklung Konzept erläutern,3g
1_PHZH_2014_MS1_cf8586bd_introduction.txt,• Bewältigungsverhalt zeigen SuS arm Familie,3b
1_PHZH_a7d0aefe_bd58d445_e4c35051_11f517f1_introduction.txt,somit Arbeit weit Sinn Standard VI pädagogisch Hochschule gerecht Lehrperson besonderer Sensibilität Umgang Kommunikation fordern,0
1_PHZH_2014_MS1_4571ea34_introduction.txt,neu pädagogisch Erkenntnis individuell Förderung einzeln Schüler Schülerin zentral Bedeutung,1c
1_PHZH_2014_MS1_81e0174a_introduction.txt,Merkmal Theorie Befragung zwei Technoramabetreuer Komponente Erfahrung erweitern,3d
1_PHZH_ac9f8553_4fcd40fc_d59f3d3c_904e75e1_7a669003_introduction.txt,Folgenden Frage möchten Arbeit nachgehen,0
1_PHZH_607d1004_e01a3e09_a63acd73_7a669003_4fcd40fc_introduction.txt,Film liefern mental Bild historisch Ereignis konkret zumeist ästhetisch Wirkungsvolle,0
1_PHZH_2014_MS1_040b4719_b11a5d4b_introduction.txt,. Erfahrung Akteur Schulsystem bisher,3b
1_PHZH_2014_MS1_040b4719_b11a5d4b_introduction.txt,Zusammenhang Fokus Selbstständigkeit Selbstverantwortung legen,2a
1_PHZH_2014_MS1_ab063590_introduction.txt,methodisch Teil erklären qualitativ inhaltsanalytisch vorgehen Lehrmittelanalyse Mayring,3g
1_PHZH_8881d2aa_ Departement Sekarstufe I_3ee137a2_e01a3e09_introduction.txt,Ausführlichere Information Film folgen Methodenteil . vorgehen Methode,3g
1_PHZH_2014_MS1_7dc244ae_introduction.txt,Schluss Anwendungsmöglichkeit ausgewählt Unterrichtsmethode -konzepte Sportunterricht darlegen Beispiel ergänzen,3g
1_PHZH_2014_MS1_1df949aa_9685d328_introduction.txt,abschliessend kurz Überblick Aufbau Arbeit aufführen,0
1_PHZH_0e7beff5_f226f278_4fcd40fc_ Departement Sekarstufe I_c7296853_introduction.txt,Masterarbeit nehmen Bezug Standard  Heterogenität  Schule Gesellschaft,0
1_PHZH_2014_MS1_2b75f2b3_introduction.txt,dritter letzter Themenbereich Theorie folgen knapp Abhandlung Kompetenz Schwerpunkt überfachlich Kompetenz Lehrplan .,3g
1_PHZH_4fcd40fc_2ddc90ae_7a669003_c72b17ed_introduction.txt,vorliegend Arbeit gliedern zwei Teil,3g
1_PHZH_276a5fc3_ed537019_4fcd40fc_dc411c57_a999b01e_ Departement Sekarstufe I_introduction.txt,Kapitel setzen verhalten Lehrperson Lektion auseinander beschreiben Endprodukt Schreibprojekt Klasse gemeinsam verfasst Liebessroman,3g
1_PHZH_8a10f9ae_e23bf532_4fcd40fc_57c4b296_6c2cf7e3_7a669003_introduction.txt,Seith & Kavemann  S.  betonen allerdings Schule Ort darstellen Thematik aufklären sollen,0
1_PHZH_59a90fd8_4fcd40fc_5327f408_ Departement Sekarstufe I_437a0090_introduction.txt,Diskussion Ergebnis finden Kapitel statt,3g
1_PHZH_4fcd40fc_2ddc90ae_7a669003_c72b17ed_introduction.txt,kritisch Analyse Reflexion folgen zweiter Aktionszyklus verändert Handlungsansatz,3d
1_PHZH_2014_MS1_1817df64_introduction.txt,zudem offerieren Oberstufenschulhaus breit Zusatzangebot Wahlfächer diverser Fremdsprache sportlich sowie musisch Vertiefungsangebot SchülerInnen auswählen,0
1_PHZH_2011_MS1_2352efa7_introduction.txt,weit Abschnitt Forschungsergebnis qualitativer quantitativ Form entlang Fragestellung präsentieren sowie Hintergrund theoretisch Aspekt diskutieren interpretieren,3g
1_PHZH_51b58dcc_7d0941f4_56b082fa_7a669003_introduction.txt,Kapitel Anhaltspunkt Durchführung kooperativ Lernform Unterricht erläutern,3g
1_PHZH_2014_MS1_2bbf72a7_introduction.txt,zusätzlich . Kapitel heutig Situation Schweizer Schulsport beleuchten Formulierung Lehrplan vergleichen,3g
1_PHZH_574404cd_7a669003_4fcd40fc_0e7dd130_d76c66ea_introduction.txt,Untersuchung entsprechend Literatur zeigen Anstrengung Richtung unternehmen,0
1_PHZH_2014_MS1_7db60009_introduction.txt,.,0
1_PHZH_276a5fc3_ed537019_4fcd40fc_dc411c57_a999b01e_ Departement Sekarstufe I_introduction.txt,Kapitel stellen Verbindung Schreibmotivation Schreibprojekt Liebesroman her präsentieren zuzüglich möglich Erweiterung Schreibarrangement Anregung zwei weit ähnlich Genre nämlich Kriminalund Abenteuerroman,3g
1_PHZH_4fcd40fc_09a8ec4a_ Departement Sekarstufe I_a6ac235e_d435f07a_introduction.txt,PISA-Studie Lesekompetenz anhand Vielfalt unterschiedlich Lesetext verschieden Ziel gegenüber Text global lesen detailliert lesen usw. untersuchen Ziel Gelesene lernen Art handeln denken Sein verstehen,0
1_PHZH_2014_MS1_7dc244ae_introduction.txt,theoretisch Teil vorliegend Arbeit befassen Definition Trennung Begriff Integration  Inklusion sowie Schweiz geltend gesetzlich Regelung Sonderschulung Schülerin Schüler besonderer pädagogisch Bedürfnisse,3g
1_PHZH_607d1004_e01a3e09_a63acd73_7a669003_4fcd40fc_introduction.txt,Aktualitätsbezug Thematik Vietnamkrieg unterstreichen zudem Aussage  Vietnam sprechen immer Zusammenhang USA geschehen,1c
1_PHZH_af46a886_3beda123_b58d1e70_09717d62_c70fa686_dfcfd993_4fcd40fc_3567c78e_c713876f_0034d060_introduction.txt,Muss Lerneinheit Vorwissen Schülerin Schüler anknüpfen,0
1_PHZH_87e91429_c53a9081_4fcd40fc_7a669003_e696c4b9_introduction.txt,jugendliche beschäftigen demnach fast ausschliesslich Handys Internet Alkohol Parties Gewalt,0
1_PHZH_2014_MS1_93f526f5_introduction.txt,Kind Zeitpunkt Übertritt relativ jung deshalb davon ausgehen gänzlich eigenständig Entscheidung fällen kommen Bildungsaspiration Eltern besonderer Bedeutung,1c
1_PHZH_180dda13_7a669003_4d668c53_4fcd40fc_introduction.txt,zweiter Teil Funktion Printmedien bildungspolitisch Debatte frei Schulwahl darlegen fünf wichtig beteiligen Akteur Position vorstellen zentral Begriff definieren,3g
1_PHZH_2014_MS1_be36150e_39435396_introduction.txt,Tatsache einzeln Schüler Schülerin Alkoholismus Elternhaus kennen häufig vergessen,0
1_PHZH_607d1004_e01a3e09_a63acd73_7a669003_4fcd40fc_introduction.txt,praktisch Teil zuerst Kriterium Auswahl Spielfilm eingehen,3g
1_PHZH_87e91429_c53a9081_4fcd40fc_7a669003_e23e6810_introduction.txt,basierend Befunden Medienund Publizistikwissenschaft sollen Masterarbeit Image Printmedien Meldung Lehrperson verbreiten untersuchen,0
1_PHZH_2014_MS1_562e4ab2_introduction.txt,erster theoretisch Teil aktuell Forschungsstand wichtig Untersuchung Thematik zusammenfassend darstellen,3g
1_PHZH_607d1004_e01a3e09_a63acd73_7a669003_4fcd40fc_introduction.txt,Hierin begründen Wichtigkeit vorliegend Masterarbeit vermittelt Bild historisch Ereignis darstellen historisch Spielfilm beschäftigen,1c
1_PHZH_416b9c70_4fcd40fc_34e280f1_7a669003_a43bb46c_introduction.txt,Leser reflektieren zudem möglich Einfluss Schülerin Schüler,0
1_PHZH_4fcd40fc_09a8ec4a_ Departement Sekarstufe I_a6ac235e_d435f07a_introduction.txt,Fokus Arbeit liegen einerseits Fremdsprachenunterricht Fach Englisch andererseits Lesen Kompetenz Unterstützung Fremdspracherwerb,2a
1_PHZH_2014_MS1_2b75f2b3_introduction.txt,empirisch Vorgehen erklären Erhebungsinstrument sowie Stichprobe vorstellen,3g
1_PHZH_7a669003_b5e98c9a_c7296853_21428f03_introduction.txt,vorliegend Masterarbeit verfolgen grundsätzlich zwei Ziel,3a
1_PHZH_2014_MS1_1817df64_introduction.txt,Arbeit erster Linie Musik Interesse genau Thema ausweiten Einblick komplex Feld geben sollen Schulfach Musik weitervermitteln,2a
1_PHZH_244db2a8_e31c8aa4_7a669003_4fcd40fc_introduction.txt,vierter Teil Ergebnis Hilfe Grafik darstellen präsentieren,3g
1_PHZH_2014_MS1_1f00be7e_aa2ab8ba_introduction.txt,innerhalb naturwissenschaftlich Unterricht nehmen Experimentieren zentral Rolle,1c
1_PHZH_2014_MS1_1f00be7e_aa2ab8ba_introduction.txt,anhand Fragebogen spezifisch Datum erheben Auswertung Ergebnis Experiment vergleichen,3d
1_PHZH_c0c47aac_e01a3e09_a63acd73_4fcd40fc_7a669003_introduction.txt,Aufbau Masterarbeit drei Teil ordnen lassen,3g
1_PHZH_8a10f9ae_e23bf532_4fcd40fc_57c4b296_6c2cf7e3_7a669003_introduction.txt,zuletzt lassen Masterarbeit nochmals Revue passieren formulieren Erkenntnis Masterarbeit Schlussfolgerunge zukünftig Berufstätigkeit Lehrerin,3g
1_PHZH_607d1004_e01a3e09_a63acd73_7a669003_4fcd40fc_introduction.txt,neben Element Ausbildung Soldat Heimat konzentrieren existieren Kriegseinsatz selber,0
1_PHZH_b63cee49_764f4fe1_1e8ec8a0_d4c16655_introduction.txt,fremdsprachlich Leseforschung letzter Jahr breit Forschergruppe Methode extensiv Reading stark,1e
1_PHZH_87e91429_c53a9081_4fcd40fc_7a669003_e23e6810_introduction.txt,Image aufnehmen interpretieren Umgang Imag Identifikation Berufsimage wahrnehmen bedingt Persönlichkeitsdimension,0
1_PHZH_2014_MS1_74c9a371_introduction.txt,Forschen bringen Lehrperson Unterricht reflektieren weiterentwickeln,0
1_PHZH_8a10f9ae_e23bf532_4fcd40fc_57c4b296_6c2cf7e3_7a669003_introduction.txt,dabei erfolgen Reduktion Datum wobei relevant Aussage Vordergrund rücken,0
1_PHZH_2014_MS1_55a86fc5_introduction.txt,anschliessend wichtig Determinante separat Gesichtspunkt Umsetzung Unterricht betrachten wer zweiter Fragestellung führen,3b
1_PHZH_4fcd40fc_e01a3e09_7a669003_f04d0429_9d7a2722_introduction.txt,Gemäss Richtziel Fach Vergangenheit Gegenwart Zukunft Zürcher Lehrplan bestehen wesentlich Ziel Unterricht darin Geschichtsbilder erkennen thematisieren,0
1_PHZH_2014_MS1_4baa6d00_introduction.txt,danach Forschungsteil Schulklasse überprüfen Dilemmadiskussion Methode Moralerziehung Einsatz Holocaustspielfilme Dilemmageschichte Grund liegen moralisch Urteilsbildung fördern,0
1_PHZH_c53a9081_057a2bfb_4fcd40fc_87e91429_7a669003_introduction.txt,motivieren Schülerin Schüler Situation Leistung zeigen,3b
1_PHZH_a7d0aefe_bd58d445_e4c35051_11f517f1_introduction.txt,stattdessen möchten untersuchen Sowjetunion Werkunterricht DDR rezipieren,0
